Review_ID,User_Name,Platform,Rating,Thumbs_Up_Count,Review_Text,Date
13490388-e987-41a9-a540-267418d7de9b,JKWarrior Fitness,Google Play,2.0,0,I recently switched back to the free version. so many features have been removed. I can't even use Spotify offline anymore? like that was the whole reason initially switched over to it back in 2018. I guess it's time to find a more user friendly app,2026-06-20 00:37:55
720366ae-d26d-432c-88fd-d7bd456e2f62,Vilasini k Viliasini,Google Play,5.0,0,happy,2026-06-20 00:33:05
6fcf446c-4d31-4a52-9dd5-3a80736917d4,Albert Allums,Google Play,5.0,0,boi,2026-06-20 00:28:11
7805298f-e7b5-4a6e-b968-d44810b78621,onwusah chibuzor,Google Play,5.0,0,I love this app they best,2026-06-20 00:28:02
351ef8f0-d87e-423d-a8a2-9ed8c7d3195b,Andre Santos,Google Play,1.0,0,still no lossless in PH. just use apple music,2026-06-20 00:27:10
1a5ac9f3-228b-4c2e-a171-35a3e842b439,Dave C,Google Play,5.0,0,really well designed and easy to use,2026-06-20 00:23:32
abd68045-a2c8-4906-9f45-064a2e156538,Freedom Smith,Google Play,5.0,0,For about fifteen years now across dozens of devices I have never really experienced major enough bugs to prevent me from enjoying the app.,2026-06-20 00:23:09
abf296e5-eee3-4ef6-a22b-19ebcb93036c,Vikas Gaurav,Google Play,5.0,0,I love the way Spotify app connects with my Alexa and Wi-Fi speakers seamlessly.,2026-06-20 00:19:55
0b89cb48-1161-47b5-83a4-fbe0271365bb,Latanya Young,Google Play,5.0,0,the best app ever!,2026-06-20 00:14:52
489cf626-7b84-4ea0-a3e7-f96675b2553c,Nkosikhona Msomi,Google Play,2.0,1,"Maybe I do not understand the lay out but I'm having difficulty having New music like recently releases or new mixes. I have a PS5 so I moved from the other music app to join this app. When I did That I imported all my music to Spotify using another app. But all I hear or what is presented to me is my own music or mixes of the music that I came with. Please help. I need new music, like new albums and mixes from djs. I already had music when I came to this app, I wanna listen to more new musi",2026-06-20 00:05:50
936b50be-f84f-4ec1-9498-24364c36b523,Bhanu Karri,Google Play,4.0,0,this very nice app to listen anything song you like,2026-06-20 00:05:42
2a72092a-cea4-4053-b9d2-e077e46b07b3,Charles rich,Google Play,1.0,0,give me back my widget & I'll give more stars,2026-06-20 00:01:38
17ed7803-d984-413f-a787-050cddecad24,Zion Oshiyoye,Google Play,5.0,0,Best music app I've ever used,2026-06-20 00:00:45
3ce84788-deb1-4e35-ae03-5c06b8184802,ِ,Google Play,1.0,0,Spotify has fallen off. Switched to Apple music.,2026-06-20 00:00:24
34f98486-c4f1-4dba-9f29-ebad08397395,Rhessane Hennani,Google Play,2.0,0,the ads,2026-06-19 23:59:46
dcb758ca-6224-4fbd-aa9b-011d62aef3ce,Dhruv Meena,Google Play,5.0,0,Thank you 💕,2026-06-19 23:59:35
54f29972-2271-409f-9eb4-c22a58baaa5f,gaarabae,Google Play,2.0,0,"i am a spotify premium user. in the notification tab, it often shows shows i havent played or songs from days ago which i havent played. otherwise, spotify is garbage. the owner, the management, the ui, the algorithm.",2026-06-19 23:59:22
a5c2a48e-47b2-4e30-a6d3-d8b48b0d5a59,Samkelo Sphiwe,Google Play,5.0,0,the best app ❣️,2026-06-19 23:57:50
342242b9-1b51-428f-b859-cfc297532b13,Kelvin,Google Play,5.0,0,Excellent,2026-06-19 23:57:03
2d963b8c-4c35-48c3-a82f-7abb36cf0d84,SAURISH SETH,Google Play,3.0,0,sending popups for premium and after this I can't change the song 😞😒,2026-06-19 23:56:13
e76c974f-7cef-4e28-bae9-0fde61bf75bc,Fateme Malaijerdi,Google Play,5.0,0,astonishing 👌,2026-06-19 23:55:46
98350a55-a393-4c7a-bfb3-9ec1cf0533a9,Nathan Hickinbotham,Google Play,5.0,0,not long been using premium but it's the best thing I did my love for music has just been made more loveable due to this app love it five stars also my sister has used it for years and recommended it to me now that I can afford to use it,2026-06-19 23:53:30
3aaf77f7-371b-48de-a922-48cacee47eac,Cooper Minion,Google Play,2.0,0,"it's been great until yesterday. I can't get the app to fully open on my phone. all I get is a blank screen. what's most annoying is that I'm able to open the app on my tablet, but not my phone. please fix this problem",2026-06-19 23:50:07
2773ae33-8b4a-4120-99af-d39f0cef8590,Bradley Petty,Google Play,2.0,0,"Spotify is one of the greediest apps I have ever seen, you have ads every 4 songs and you'll get about 5 ads if you dont have premium, you can't organize your music listening either. The only redeeming quality of it is the selection of music it has.",2026-06-19 23:49:03
5a3a12ab-7e00-45a8-b2ae-7ae12eff3556,Mishti Sheoran,Google Play,1.0,0,lovee it,2026-06-19 23:47:37
0165ee73-6c34-409d-a7f1-25bce4bc28a7,rayana cruz,Google Play,3.0,0,too much ads mate,2026-06-19 23:47:07
f730cc69-8d98-4327-a154-18b459c5b126,Tyleem McClain,Google Play,5.0,0,👍👍👍,2026-06-19 23:46:07
cb2b7923-7284-4db3-bc7a-abc5ba249c7a,Manelisi Mtshali,Google Play,5.0,0,"Spotify is one 👌 of a kind, literally it's the best. coming to think of this now it's the only application with short interrupting ads so thank you Spotify 4 keeping us entertained",2026-06-19 23:41:23
0cf8c2b5-dff2-498f-a2d5-1c35c26efd93,Berry Chuku,Google Play,5.0,0,BEST💯,2026-06-19 23:41:03
6fb9e141-9f67-47e8-ac6d-cf62b271cbe5,Julie Onoriode,Google Play,5.0,0,❤️❤️,2026-06-19 23:40:57
1efa2726-54c5-448c-95cb-f4e1115ec68e,Vishnudharan,Google Play,4.0,0,good but too many ads,2026-06-19 23:40:28
c10d01dc-8c3a-4a2e-b400-dcd11437217c,Satyam rai,Google Play,1.0,0,Irritating,2026-06-19 23:40:15
7406fac6-cbbd-4b4c-bfbb-8965e843a614,Kaif Ansari,Google Play,1.0,0,very good 👍😊,2026-06-19 23:35:23
f6459060-b4b9-40fe-8b40-9eb37626e5bb,Aleksandar Georgeski,Google Play,1.0,0,It became disaster,2026-06-19 23:34:49
37e89e88-523b-4834-b620-65343438ad3a,Vaishnavi Sarav,Google Play,4.0,0,love it 🤩,2026-06-19 23:33:52
a76dcd2c-83db-4420-b96d-1c78b4a85680,Neezy Hobjan,Google Play,5.0,0,i love this spotify,2026-06-19 23:33:35
edd3cd4a-c48b-450a-b5d2-f37bad4c104b,Marc Kay,Google Play,1.0,0,Literally can't login with the correct password - condascending dev response too.,2026-06-19 23:31:35
7759350f-87ce-435b-b5c3-b9600edda098,Evan Feist,Google Play,5.0,0,The new DJ mode is awesome! I usually hate AI features but the AI bot is actually really helpful for exploring artists and what songs producers have worked on. Great update.,2026-06-19 23:30:01
07391170-3330-4c0a-aea4-295f1130431f,blessing ada,Google Play,1.0,0,Tell me why after charging me a fee and I am still struggling to hear premium music without adds,2026-06-19 23:29:55
d95fbe29-85f6-4ab5-89b6-51254ce2b25d,gideon Daniel,Google Play,5.0,0,Best experience ever,2026-06-19 23:29:39
d5e01e4b-e7ca-4cb3-b463-6920cf5f1294,George Kavula,Google Play,5.0,0,"Great experience with this👌 I can find all my favorite songs, even from back then.",2026-06-19 23:29:00
a22568ba-09a3-4b24-94ef-535bdde234c6,CHINTAN PARMAR,Google Play,5.0,0,"it's made for me, it's like I am living for Spotify l, without it I can't imagine my life,cause I use to hear songs while gym, going to school,while doing hw and many times in a day too.",2026-06-19 23:28:40
1d69d174-9bbe-4386-ac21-a2dc51241d99,Denise Cole,Google Play,4.0,0,love my streaming account with Spotify,2026-06-19 23:27:04
4b3746c8-277b-4ed1-9c91-071e8c8d68bd,Iconic YT,Google Play,5.0,0,GOAT,2026-06-19 23:25:25
e0b9586e-63ce-4d52-b133-94cf0164662b,Dylan Vib,Google Play,1.0,3,"stop rate limiting users, my cache is at 20Gb that's ridiculous",2026-06-19 23:25:24
dc27f9c9-7dd4-4a0a-bd88-7b68739cbbaa,Christos P,Google Play,5.0,0,stilp remain number 1,2026-06-19 23:23:04
39054f51-7ffa-4c09-bd20-1dfd4b5ec3dc,BEN LOWE,Google Play,2.0,5,"Is anyone else getting the same message ""Soundcore app is closing down"" & once connected it stops. I have just updated & it's now had a reversal of the update - a downgrade ! After the update I closed all my apps & am about to re-boot the phone... Will see what happens & report back - incidentally I am running a phone which I'm surprised any app is still running. 5* WILL BE RESTATED UPON FIX.",2026-06-19 23:22:25
3e44003e-55ee-498c-a8ac-cbac7ae0ecc1,Vedika,Google Play,3.0,0,overall great but as a non premium Spotify member they let songs spawn in my ads,2026-06-19 23:19:24
6500b19b-894c-4495-9729-5e2cffaba335,Joshua Rodriguez,Google Play,5.0,0,we listen to Spotify every day.,2026-06-19 23:18:42
6aaa2182-32d4-4c89-bf2e-f91a06f51c98,Shuats Nelson,Google Play,1.0,0,after two' songs ads what the hell hilarious.,2026-06-19 23:18:38
8602abd6-8770-47a3-8afe-1e1a5cff21c9,Shwetha Shwetu,Google Play,1.0,0,Spotify was one of the best apps but now if you don't have premium you have absolutely no control over the app you can't even choose the songs you want to listen you're forced to listen to their recommended playlist and you can't even skip more then six songs.,2026-06-19 23:15:25
b8031660-0b3f-4f25-a5eb-303b0a4c16e3,Isidro Gonzalez,Google Play,2.0,0,they need to relax with the commercials trying to push the paid version too much might push people away,2026-06-19 23:15:13
119e5718-1fbd-4054-8d12-a321a34a75d9,Kellergirl,Google Play,1.0,0,"This keeps crashing and restarting. I've uninstalled and reinstalled and restarted my phone several times, and my phone keeps telling me this app has a bug. Please fix this. I pay for premium and this is ridiculous.",2026-06-19 23:14:58
8a29ff07-e30f-4f8e-8de2-f83df66533c9,da420wizzard,Google Play,4.0,0,love Spotify been trying to get my grandpa on it for a few years now my only complaint is sometimes I have to go and re-add songs to my liked playlist because of licensing issues.,2026-06-19 23:12:53
e8ef5d4e-a317-4827-afd7-9573d7f6f3de,Rutvik Baraiya,Google Play,5.0,0,this is great,2026-06-19 23:11:02
d94d0cbb-14a8-4fa7-82c5-55ebe2fa6368,Pulane Qopela,Google Play,1.0,0,why in the world do I have to get forced to pay premium what if I don't have $1?,2026-06-19 23:10:17
75405056-3f2c-4118-b0d4-5c10abf5803a,Ricky Mcdonnell,Google Play,5.0,0,wanktastic,2026-06-19 23:09:27
7edea58c-733f-430c-a467-704a5667afbd,Ansh Kumar,Google Play,2.0,0,good but not good 😐,2026-06-19 23:08:55
83fa36be-6b4e-489f-b079-d26341bd96d8,8B OM JAISWAL 44,Google Play,5.0,0,this is very good,2026-06-19 23:08:24
dfb34d0e-5e05-4655-a3d3-3541f91c0786,Tabassum Ety,Google Play,5.0,0,it's good but not free,2026-06-19 23:06:47
faf7caee-c79a-4f2b-80d1-41f03beaf7d9,Munyaradzi Mukoki,Google Play,5.0,0,I can't log in to my acc I've tried everything and it keeps saying something went wrong I'm I don't know how to do a follow up but thank you I was helped and was able to log back in🩷🫶🏾,2026-06-19 23:06:04
b532b812-e1a8-47ce-98c9-8a4ebddd8c23,Gaini Bhanu,Google Play,5.0,0,Super music world Spotify app........,2026-06-19 23:05:38
3317fc61-498f-4857-b7f3-4c1bae6731cc,La Pidd,Google Play,2.0,2,"11.99 a month and it has error messages when searching for songs. absolutely rubbish, and no live support. Imagine charging people for a subscription and offering no support. edit - their servers were down, as indicated on downdetector by thousands of users, but their response is simply to try reinstalling, instead of being honest and accepting that the fault was at their end.",2026-06-19 23:02:15
31dd29f8-0c47-4208-9163-945335997d23,pixie stix,Google Play,2.0,1,glitchy and expensive just to be able to listen to a particular tune :(,2026-06-19 22:59:08
fc4b56dc-92f9-4b6b-97c8-e879e8abe0d0,daniel caesar,Google Play,5.0,0,V is very very extraordinary,2026-06-19 22:58:18
0eb97af8-0ee7-4f14-83f0-cf5d122d2a95,Yaser Manzoor,Google Play,5.0,0,very greatt,2026-06-19 22:58:11
5aa1fcb7-d942-4b27-b682-8d5f615e573e,Sophia Vences,Google Play,5.0,0,I love Spotify but I hate the ads and I hate the fact that we have to pay for no ads.,2026-06-19 22:56:33
9dab0da7-9b5e-45ed-804c-61db50457ff4,Vivek Joshi,Google Play,1.0,0,ads ke chode,2026-06-19 22:54:16
ea13179f-8791-4c43-bbc2-ddebbf61ecc4,Arshiya Harmain,Google Play,5.0,0,super spotify song please do download,2026-06-19 22:54:03
141b7bca-216d-473a-a46e-5db55ded8465,Gupta Vinayak,Google Play,5.0,0,Loved the app,2026-06-19 22:52:51
33f4eb31-4b27-40b5-b2d5-3477ff4c2f24,Kosar Tariq,Google Play,4.0,0,nice app for all kinds of music and the premium feature is also good and reliable 😄,2026-06-19 22:52:24
03a8d92b-b6ab-455f-881a-d4d85e626b7f,Iryna Pavlivna,Google Play,1.0,2,Why doesn't music start on the device where it actually started? why it plays on random other devices around me? this is so upsetting and frustrating!,2026-06-19 22:51:52
64cb6b5b-761d-41d7-8e28-7b277baa2eff,Nikita Rai,Google Play,5.0,0,"love this app , and love u Spotify 🤩 please right now don't demand subscription to me , I am student. May be next year you can, Thank u .( I am saying this because u off my all play list song 😭 and my mood went off but after some time u will fix this suddenly I am surprised but thank u 💓 )??? Love this app again thank you 💛💛💛",2026-06-19 22:51:45
c413278c-7067-40c0-a12f-1b0652e98d40,Leilani Khalid,Google Play,5.0,0,I liked how I got a free trial the first 3 months,2026-06-19 22:51:08
7d103fb8-2ad8-4556-b432-5e4a2d8fb053,Jack Moxham,Google Play,2.0,0,Slow and frustrating to use. Constantly re-downloading playlists which haven't changed since I downloaded them. UI is good...once it loads...,2026-06-19 22:49:14
4d6b489b-238c-45e4-b51c-7db342d4f710,Jake funzone,Google Play,2.0,0,"I used to love this app, great song collection and all but too much adds for free users ,i understand ur trying to get revenue and all but, there is like 6 adds every 15 mins and each add is like 50 or 60 secs like come on man 👎👎👎",2026-06-19 22:49:09
ed800609-026d-4cba-9c42-198c293f4156,Sabrina L,Google Play,1.0,0,"Spotify has decided to delete their Wifi only setting. The app is ALWAYS running background data, and it just used nearly half a gig overnight. I'm done with this app.",2026-06-19 22:48:31
9cdc6071-e71d-4e7c-810f-69cb48dd2cdd,Nina,Google Play,3.0,0,"easy to use, however the amount of ads between each song is ridiculous and the inability to turn off shuffle unless you buy spotify premium can be annoying if you want to listen to an album/playlist in order",2026-06-19 22:46:15
75ed3570-01f8-4128-be55-00fe6fd0f876,Yuvaraaj Nagalingam,Google Play,5.0,0,it's more good if u don't have to pay for it,2026-06-19 22:43:18
65ffd507-016f-4711-b8dd-84f6aa1b1d45,Joseph Porteo,Google Play,5.0,0,it's easy to find my favourite music,2026-06-19 22:42:05
de7a4840-3548-43d1-af4d-678d66d7f713,Yvette,Google Play,2.0,0,"I have been a premium subscriber for many years. However, something changed in the app, there was an update on 6/16/26. I've cleared cache and erased data. The app keeps closing and then I'm getting a pop up saying that there is a bug in the app. When will this be fixed?!? I have hardly been able to use it in the last week!!",2026-06-19 22:36:51
0c4d3da1-e4d4-4281-a142-27fc5572f7da,Ben Roberts,Google Play,1.0,23,Greedy.,2026-06-19 22:35:53
c9613445-419c-4807-9994-4cffbe112beb,Tim Ross,Google Play,5.0,0,Awesomeness,2026-06-19 22:35:23
d4db1ca8-2b1e-4488-b98a-72cf8d888053,Menath danthanarayana,Google Play,5.0,0,very fun but can you guys please give Spotify premium free?,2026-06-19 22:34:45
f882b371-54dd-4771-a2c5-c799e1f13d58,Doug Sheffield,Google Play,3.0,0,"since the update, the app will not stay running. constantly stops",2026-06-19 22:34:29
bf7f8300-9fc7-4b96-8cfa-030969914175,VEERRAJU A,Google Play,1.0,0,"And worse, there are so many ads that it's annoying to listen to music. The ad song plays before starting the app. Song Song Ki Ad Music is annoying. 1/4 Ad. To listen to one song, you have to watch four ads. Worst app ever. It's best to download offline instead.",2026-06-19 22:31:22
4f59066e-407c-45ba-ae54-99d6d8de6586,Rehan Khan,Google Play,5.0,0,its is very useful porsenally i use every day,2026-06-19 22:28:25
c31b4a81-35a5-4812-82f1-1e6ab1ba326a,Adarsh Modanwal,Google Play,5.0,0,Best one,2026-06-19 22:26:04
8bed8aee-2541-4841-8fba-868e2303ae80,Puteri Sarah,Google Play,5.0,0,100 million songs at your fingertips. Auto-generated playlists based on my taste are spot on. Podcasts are great too. Sound quality is crystal clear.,2026-06-19 22:25:46
cb409d4e-411b-4248-917f-ea65c7750934,Sonali Akolkar,Google Play,5.0,0,Very nice,2026-06-19 22:23:35
3b716a72-07da-4157-8d12-8818dd5db786,Saad Roblox,Google Play,1.0,1,worst music app every after free trial u have buy premium and u cant play song or control it,2026-06-19 22:22:38
2b43138c-e017-4ff9-aacb-3f917e12e462,david davidison,Google Play,1.0,0,"Remember the days when this app was really good and enjoyed it a lot . Now you are limited to a few tunes a day, that's crazy, I can see why everyone going back portable media now... it's time for everyone downloading your own music on different devices.",2026-06-19 22:21:26
7a300e63-cf26-4420-a35a-5d4e57962b7f,Jatin Kumar,Google Play,3.0,0,although the app is good it's drains a lot of battery. A lot of battery. also it has a lot of lag and glitches. not so good experience,2026-06-19 22:19:48
ecdd0103-453b-435d-b2b2-c7c25322f127,Ieo jasen Awit,Google Play,5.0,0,the problem is the ads only,2026-06-19 22:17:31
4a896eef-80a5-483d-9b90-7ca7859f0b31,Puja,Google Play,5.0,0,my fav app,2026-06-19 22:16:26
17f8b5d2-9946-4efd-bf12-e655a4c8666c,Dera Onwe,Google Play,3.0,0,"dude I use a Samsung s10 and nothing is wrong with my device. if I open spotify, it closes by itself after some sec while I'm playing music. I don't know what's wrong. I Uninstalled and then installed again, it still did the same thing. I'm rating 3 stars cause I know you guys will fix this problem. and please do it quickly. I pay for this service every month.",2026-06-19 22:14:47
a536357f-0412-4ec9-ac34-b232e4c38d11,Anand Maurya,Google Play,1.0,0,the worst app i have ever seen the ads and now I can't even play my own playlist properly what is the use of Spotify then,2026-06-19 22:12:55
9ecb726c-9b0c-4dee-98f2-55af091af704,Jennifer Harroun,Google Play,1.0,0,The widgets aren't showing in Android 15. Are you still supporting this version of Android? I hope so.,2026-06-19 22:11:26
0503bbb8-ab65-487a-b1f0-c268f318c9cc,Udit,Google Play,1.0,0,using monopoly to buy their premium..too much ads.. can't listen to search Music .gonna transfer to other platforms,2026-06-19 22:10:37
04476b24-b169-4bbc-8075-bb3d162aee6f,sara,Google Play,5.0,0,can hear variety of song from any country,2026-06-19 22:09:47
dbebfd1f-100a-4871-b900-1d86b22ae640,Lakecia Allison (AquaQueen),Google Play,1.0,0,Lately I cannot stop the app from bugging and closing out on me mid song! The subscription is too much to deal with this. I am about to cancel my goddamn subscription!,2026-06-19 22:05:20
ff2edd9f-68ee-40c9-b0de-1cb1e25af1fe,Ghost deadly,Google Play,5.0,0,عالی هست,2026-06-19 22:01:19
d90d364f-9cd8-4dc6-b875-fc43a77839a3,Laurie Ann York,Google Play,1.0,0,I want to delete Spotify but I don't even have it downloaded on my phone.,2026-06-19 21:59:40
8058565a-b3b1-4bf2-a74b-5bf056aecca6,Gaile Lapera,Google Play,4.0,0,"My default music streaming service app, I love it, but sometimes the bugs are so annoying. for example: I tried to open Spotify and it showed nothing, literally just a black screen; had to delete the app because restarting my phone didn't fix the empty black interface.",2026-06-19 21:59:37
898cb77a-61f7-41d8-a5db-3d8fb9f9216b,wankidame sun,Google Play,1.0,0,"if u r a premium user then , this app is good n all but if ur a free user the. this app is the worst",2026-06-19 21:59:11
607f4b0d-39c6-4da4-b1b8-d1c2348eccf6,Emmanuel Mumo,Google Play,5.0,0,exceptional 🌟,2026-06-19 21:56:04
35f57b4e-b299-4916-aec3-9e43674d5656,Paul Black,Google Play,5.0,0,"I love Spotify - only subscription that's worth consistently paying for in my opinion. we enjoy going to concerts, so the connection built in to events and ticketing is so helpful.",2026-06-19 21:55:43
159f87de-573d-404e-97ac-cf1d55c2e847,Victor,Google Play,2.0,1,trouble opening the app. I thought it was cause of my device or network until I tried with my iPhone. same issue. cancelling my subscription soon,2026-06-19 21:55:12
3c7a2304-1e88-42e3-86f7-721881310e10,Ansh Raj,Google Play,1.0,0,most worst app they wanted premium for everything like skips download songs and etc,2026-06-19 21:54:21
da29ec7f-5c18-4ce2-ae74-a2d47701aa9c,Vivienne “Junifox” Renard,Google Play,3.0,1,"love it when they add new features nobody asked for that makes it harder to actually listen to the songs I want, and said new features crash the app when I search for longer than 5 seconds for a song",2026-06-19 21:50:33
a5de4a06-e035-4639-810d-4264bccbbb2d,Edward Neal,Google Play,5.0,0,All My Music From Childhood Still Today Everything Allgood Thank You,2026-06-19 21:48:20
1b1d3a11-d88f-49ce-8fc4-bb44b5db1771,Winston H,Google Play,1.0,0,"won't let me pick the songs I want on the free version, I'm not playing for premium!",2026-06-19 21:47:12
6c04fb21-7700-4a2e-b464-ab5a55b3eeed,Robert Hamilton,Google Play,1.0,11,A true invassive app. The auto connect/play feature needs to die. Just because my device is connected and or I turn the volume up on my stereo does not mean I want to listen to spotify. The shuffling of songs/artists when shuffle is turned off is unacceptable. Last but not least the repeat and recycling of the same songs and not hearing others out of my 2000 plus liked songs is also unacceptable. 260619 Been having the same problems with spotify. I just did the app update today at 1215est.,2026-06-19 21:45:54
f303b267-be14-4d05-a02e-a5a840bce8d8,xavier trix,Google Play,5.0,0,The BEST,2026-06-19 21:44:52
ce06e472-2d22-4f09-8073-215b36ef4973,cynthia Ebere,Google Play,1.0,0,"doesn't open reply _I have uninstall it almost 10 times and installed it back, it opens sometimes,the doesn't open again",2026-06-19 21:43:06
120e70ce-77ab-40de-9da8-e0428dedbda0,DRACO,Google Play,1.0,0,such piece of smtg. This app is for listening music but I couldn't even change my music. To change my music i needed premium for it if I was former premium user. Very very bad app,2026-06-19 21:42:23
d43a5b56-134c-4e7e-b2ef-dc684f1c79f9,Brittany Larson,Google Play,4.0,0,"Please, please fix the widget or add another smaller one! I use the widget all the time and the new one is too big and often doesn't even work.",2026-06-19 21:42:19
6d8be36e-0986-4ebd-af38-5f84ce79f786,Rayyan Ali,Google Play,5.0,0,nice I really like it it's the best music app fr,2026-06-19 21:41:56
99c52939-cc00-43f6-b8a1-977ffab00229,Nkululeko hlungwane,Google Play,5.0,0,best of the best,2026-06-19 21:41:16
58dc833f-311c-4835-8a5f-24921636a93d,Jason Bennings,Google Play,1.0,0,"i listened to ONE ALBUM, it signs me out, and when i try to sign back in it's just an endless loading screen.",2026-06-19 21:39:09
011406bb-c7eb-4ff7-997b-0f3e2b95bfc4,EG EGgopinath,Google Play,5.0,0,good musics,2026-06-19 21:38:32
9aa29698-cd6f-4bed-b377-de8a0d931426,Kaushik Baruah,Google Play,1.0,0,nowadays Spotify has turned into advertisement app.. atleast before 2 ads and 30 mins of uninterrupted music but nowadays 2 songs 3 ads..they turn your music into nightmare..,2026-06-19 21:36:35
1aaf0f2b-3efd-49e9-a29e-27d25b7a9b34,PiyushFTW,Google Play,4.0,0,without premium its pretty tough to use the app,2026-06-19 21:35:28
598456e1-21b9-4de9-a7ed-0d8b9846747f,Cecilia,Google Play,2.0,0,"El nuevo widget es horrible se traba a cada rato y se pone como si estuviera cargando sin importar si tienes o no conexión, se vuelve una cosa inútil. Luego si descargas podcast con video se pone a cargar como si lo estuvieras viendo sin descargar y luego no quiere reproducir ciertos episodios porq se traba, de igual manera me ha pasado que con los podcast luego se crashea la app sin importar el dispositivo me ha pasado en mi celular, tablet y computadora. (Todo esto con spotify premium)",2026-06-19 21:33:48
fec6e999-ffc5-4b36-bd82-1eccf4b8b8c5,chilli1979,Google Play,2.0,1,Keeps crashing at the minute. Never done it for years but on my Samsung it jusf keeps crashing and closing. Done everything needed to stop this but won't stop doing it,2026-06-19 21:32:28
4db7295f-ae73-40e6-9284-67d87a6f02ec,Jenil Khunt,Google Play,5.0,0,good app for song,2026-06-19 21:31:16
cd3c248e-1ff3-49bb-bbae-5969ed599cd5,Kenroy Johnson,Google Play,5.0,0,My favorite music app,2026-06-19 21:29:59
64e38bd0-398a-444a-af17-34f1a0b0d6b8,Chandler Mclaughlin,Google Play,1.0,0,"Practically unusable without premium. Riddled with ads every song, and of course, they took away the only incentive to listen to the ads, which was the 30 mins of ad free music.",2026-06-19 21:29:21
2002a052-faba-4665-af63-cbc50e5856fc,Suresh kadali,Google Play,5.0,0,its so good and gives quality song experience. And the premium is worth having. thank you,2026-06-19 21:28:56
aa9561b1-5d79-4b6f-b4a5-afee18f8472e,Arjun Khatik,Google Play,4.0,0,best app ever I tried for listening music,2026-06-19 21:28:43
0504270d-fe7a-41da-85d3-37590ee1af73,Mohd Arif,Google Play,1.0,0,"If you want to use this as a free user, don't go for it. It's complete trash—you can't even slide the music timeline or play your song of choice. Even the paid version isn't that great because there are still some limitations, so I wouldn't recommend it at all.""",2026-06-19 21:26:48
74c6b94b-ff5b-4f0d-9703-1b30fe252429,Noel Raj,Google Play,4.0,0,limited song selection? srsly?,2026-06-19 21:24:05
b3898105-b3cf-4900-8c6a-a5f958effd1b,Shubham,Google Play,4.0,0,The One Of The Most Greedy App,2026-06-19 21:23:46
5af1c3e4-cb34-4750-9b11-9827f2c29d34,Glenn Powell,Google Play,5.0,0,This app has worked out very good for me and my wife since I got the duo deal. Way better than the radio or pandora by a long shot. UPDATE I have had Spotify for about 6 years now and I am still very happy with the results of great music choices wherever I go. Thanks,2026-06-19 21:22:48
