Review_ID,User_Name,Platform,Rating,Thumbs_Up_Count,Review_Text,Date
acbbfd61-e9e6-4012-be86-3227050cb186,Femi Folorunsho,Google Play,5.0,0,best music app till I get an iPhone,2026-06-19 13:26:59
00b712e6-dda7-4baf-8c17-e4c60bc351ce,Neelam Arya,Google Play,1.0,0,if we can't even choose a single song that we want to listen...then we can't even call it a music app...waste of my phone storage...some lowlife greedy app.,2026-06-19 13:24:01
faf072f7-5b59-421b-b3e6-acbfeae22807,incredible Donah,Google Play,4.0,0,awesome 👍💯,2026-06-19 13:23:16
268a3406-afe5-4aa8-804e-515d13ac40bf,Alba Wilsonmal,Google Play,1.0,0,I used to use this app all the time but then the new updates cam rolling in and made the free version terrible I just want old Spotify back!!,2026-06-19 13:13:42
5154f65f-cdca-4283-8a9f-92629ad4b3e5,gopal kumar,Google Play,5.0,0,it's very good,2026-06-19 13:12:33
91fa7061-cfe0-4f66-b8d7-98e6b0142f01,Rob,Google Play,1.0,0,"Devs don't understand that 10x more people (including me) would subscribe monthly for 2.99. Instead they only get 1/10th the subscribers at $12.99 and lose about 60% of what they otherwise could be making. Devs also don't understand that force shuffle AND ads are too much. It drives people off the app so they get less ad revenue. If they change subscription cost to 2.99 their sub revenue doubles. If they allow no shuffle, then ad revenue also goes up substantially.",2026-06-19 13:12:06
d39df1d3-adab-4a33-ae05-24ce0d08cb0b,Patrick Adeniran,Google Play,5.0,0,I love this app. different genres of music in a single box,2026-06-19 13:10:41
85f5ded5-50c6-49f6-bbe3-be1c643f8c37,David Hawkins,Google Play,1.0,1,Persistent excessive cache build up is disrupting how I can use my mobile device. Really arrogant. Give me a slider setting to set max cache size.,2026-06-19 13:07:50
8700de7f-c9f8-42f6-8f05-aafebc022223,vishal padave,Google Play,3.0,0,"deleting this app just because u asking charges for songs , don't agree with this why we pay for songs we adjust with adds ... Gandit takun ghya tumcha app tumchya khoop app ahet je free mdhe songs eiku detat",2026-06-19 13:00:56
b9dde8ef-8b2b-4e17-bc34-fcb1c6227b6b,Baliram Korde,Google Play,1.0,0,The app is full of ads only. The worst app to listen to songs💔🤬,2026-06-19 12:59:08
2ac24c5e-9345-473a-a96e-897ac139c8a0,Amir Azadi,Google Play,5.0,0,Best,2026-06-19 12:58:32
9f3345a8-55ba-4fc2-b1ce-bea952c39935,Jan Ström,Google Play,1.0,0,Stops playing randomly after a song,2026-06-19 12:56:48
4cdd6efa-916b-4d81-99f9-39a9449db479,Soham Shelke,Google Play,1.0,0,worst app ever login problem while i am login with my phone number they show try with different number and after login they show something went wrong have another go problem showing 🤬🤬🤬,2026-06-19 12:50:39
28f30932-cd88-44f7-b1e0-7005a02d8dd4,Sujit Kumar,Google Play,5.0,0,very amazing app for listening song,2026-06-19 12:48:41
14b21081-8f3d-47d9-a69d-b2e87d02b585,kiev rien,Google Play,5.0,0,veri good ok bye,2026-06-19 12:47:48
a49f1028-61cf-4824-8e5f-b22671104a98,Austin kisakye,Google Play,5.0,1,I love the app...I will always pay for music because its my therapy...i keep updating thinking the interface will look different....can we get a more interesting interface please??,2026-06-19 12:47:43
48c74c08-6637-496a-81db-18d34ed3400d,raj abhi,Google Play,5.0,0,fantabulas,2026-06-19 12:44:28
925f8fcb-5f9c-4be3-b170-593c193fffb8,Mohammad Bilal,Google Play,4.0,1,fair enough for the quality and content for free the only problem I have faced is I see the ad i should get the 30 mins free but that's not the case it plays another ad before my time expires apart from that does everything fine!,2026-06-19 12:39:40
4c3098e9-d98e-481b-99bd-b781513159e4,Lilia Rezgui Pierre,Google Play,1.0,0,Too much adds ! impossible to listen to more than 3 songs without having ads (often in threes) playing. Spotify isn't what it used to be,2026-06-19 12:39:31
831e3db6-528b-42c0-9419-441e106515fe,Richi Benjamin,Google Play,4.0,0,"After the latest update,MUSIC FOR YOU option is not available and the music recommendation are not matching my GENRE,Had a chat with SPOTIFY agent but not much help.Please fix this issue at the earliest...",2026-06-19 12:37:12
40f087e3-d57c-4c0a-8bdb-2830b3374f3e,govind jha,Google Play,5.0,0,very good app bro try this,2026-06-19 12:35:00
18bbbd60-ddbb-41c8-9408-1babcffed259,Siphesihle Madinana,Google Play,5.0,0,Is exactly as advertised.,2026-06-19 12:23:42
3f1daf18-a568-4679-ab15-d4c1b3a85d8f,Jagdish Pattnayak,Google Play,3.0,0,Spotify ads then❎ Spotify ads now✅ this is first time i like ads of Spotify🤣🤣🤣,2026-06-19 12:23:29
0554be29-cec1-46f7-ba6a-09061f938e99,Ahuoyiza Zee,Google Play,5.0,0,it just special for me,2026-06-19 12:23:05
b97499ca-2a5f-4cc1-9a8d-c99f085f1baa,Avisha jasubhai,Google Play,1.0,0,the app logged me out and its saying my username does not exist,2026-06-19 12:18:17
9b28e159-8fd2-46b8-af48-ce894bb998db,Faruq Abubakar,Google Play,5.0,0,"Spotify is extraordinary good, but with data dooh",2026-06-19 12:17:09
5fdd5722-c384-42d5-9d68-88d129fe1010,Faith Mutsambiwa,Google Play,5.0,0,I love how simple and useful this app is - highly recommended!,2026-06-19 12:15:40
aee65b32-cb9d-4372-b122-b0cef7cd8e25,Temjen Jamir,Google Play,5.0,0,Worthy of appreciation for your overall music coverage.,2026-06-19 12:10:54
b254baf1-4700-4b4e-8015-d7e92a4b4b52,Rip _fiji,Google Play,5.0,0,it has all types of songs and cheap price for premium,2026-06-19 12:08:14
2d0b331b-1bdf-49d2-a9bd-a91b89df7518,Mobeen Khan,Google Play,5.0,0,its so good super good but to much add so good,2026-06-19 12:07:13
4d1c90dc-97b5-442d-a980-37bc425018e9,HappyMonkey,Google Play,2.0,0,"too many ads now, why did you remove the 30 minutes where you don't get any ads",2026-06-19 12:05:10
efd46d68-a65f-4b54-b0b1-3087c9f3fefa,Stephen Heron,Google Play,5.0,0,love it! it has everything I want and more,2026-06-19 12:04:50
ccc61327-052b-4aba-9d25-736ca4b1bc31,Joraram godara,Google Play,5.0,0,.... so so so Good,2026-06-19 11:58:10
351bd882-1181-4c61-9909-d2fdefc5f9af,Ebidosia Fesco,Google Play,5.0,0,so smooth,2026-06-19 11:57:07
e2e445bd-64eb-4887-b35b-8c415da01e4a,Parag Masand,Google Play,5.0,0,bhaijaan add hata do pls 🥹🙏,2026-06-19 11:57:02
0c1856c3-4fd6-4baa-ba4d-c5ccd5019381,Naitik Panchal,Google Play,1.0,0,more ads then music,2026-06-19 11:49:11
9a7c6037-eb50-48e4-8d68-361290043a11,Sunil Kumar,Google Play,1.0,0,it's have many adds,2026-06-19 11:44:57
5bcb3fc0-e967-4bb9-8b9e-15e9ecca5605,Ananjay Pratap Singh,Google Play,5.0,0,Best Music Application,2026-06-19 11:40:56
0027fd80-c288-4d6c-a4a8-986611ccdeb9,Greg Woods,Google Play,2.0,0,keeps crashing on Thursdays when release radar comes out. app just closes suddenly.,2026-06-19 11:34:31
069ed3a8-cb2f-4c7c-ba18-21bc098af1b5,Ritesh Thakur,Google Play,1.0,0,lots of ads,2026-06-19 11:27:41
595cecd9-e1a2-4c86-8a8d-7eaabacddff2,Money DC,Google Play,5.0,0,peak bc idk it just has almost everysong,2026-06-19 11:27:16
4aa821a4-1eb2-450f-b456-39e45c8c348a,Isaac Swan,Google Play,1.0,0,the amount of paywalls is sickening,2026-06-19 11:25:42
5736a01f-4a72-429d-b963-7fc1009ae277,Heena_ Shelat,Google Play,1.0,0,"too much getting Ads, and it's a really really Irritating Ohhh look at your reply You advice free premium offer? so we can collect otherwise every single person can not afford your premium pkgs.... now you are pressuring people to take a premium, there is no option to select a song if you want to change the songs 5-6 times then forcefully they give you pressure for take a premium how they spoiled the image day by day, the Spotify down now",2026-06-19 11:25:38
0830dfc0-af19-45ea-b122-6ac8b0ddb4ad,Justin Tharp,Google Play,5.0,0,I couldn't live without music & Spotify makes it so simple + finds music u will like after learning what u like! A+,2026-06-19 11:24:19
9d898365-38cb-4736-b564-5e74fc35ad62,Jolyn Haynes,Google Play,5.0,0,"Top 100% for Best Customer Service, going above and behind to satisfy their customer. making they are happy.",2026-06-19 11:19:58
b446ea93-8b7d-4f9d-8f3e-d1be66b4e025,Ritik Raushan,Google Play,5.0,0,Nice app for music,2026-06-19 11:19:17
e76f88db-1752-45a0-9231-8b392f087b9d,Ajmira Sultana,Google Play,5.0,0,favorite 🫶🍀℘,2026-06-19 11:16:52
2ab62bb4-8e10-4f4b-9bd6-0466eb3f3524,Kushi vishwakarma,Google Play,5.0,0,best experience,2026-06-19 11:11:46
cd1174a1-edb0-4499-9ffc-64015d6e7621,josephine hernale,Google Play,5.0,0,nice when it comes listening music,2026-06-19 11:11:31
ee4917da-7291-4480-acf0-a9e6741aacbe,Christopher Mwangi,Google Play,5.0,0,Best app ever,2026-06-19 11:09:56
3008baae-c41e-40c3-8bbc-27a506b442b0,Liyabona Bradley Tshikini,Google Play,5.0,0,"Spotify is perfect when using premium, but I would still give you 4 stars without premium cause I get to listen to music for free if I want to and a broader song choices to choose from.",2026-06-19 11:08:12
7e004eaa-1a6f-4e8d-b8c4-a202df706f1c,Tushar Kanta Rath,Google Play,5.0,0,"Songs collection and sound quality is simply awesome, I need to reduce the subscription price so it can be affordable for all.",2026-06-19 11:05:00
42e734a8-b234-4d9d-a99b-9d7e92d1c471,Ayush Chauhan,Google Play,1.0,0,basic features are not available and need a premium so I delete this fool app and use jio savan because jio savan provide bacis features,2026-06-19 11:01:07
4d7e5004-ef29-4cfe-888e-14174ead2b19,Saba Ahmed,Google Play,4.0,0,soo good,2026-06-19 10:58:19
2c3b63aa-321a-460b-b20a-74786f790a51,karinganire tony,Google Play,3.0,0,one ad no problem but 2 or 3 that's too much,2026-06-19 10:56:27
c9992ab0-d6fa-4fad-8726-2f4c5fa52f3f,MNR Rafy,Google Play,4.0,0,Not bad.,2026-06-19 10:52:58
5b7fc67c-ba1e-442c-a794-bffe2abb6efb,Renjin,Google Play,5.0,0,good amazing beautiful,2026-06-19 10:48:03
46f9392a-e8ab-497a-8ecc-bbde089544ce,Kami K.E,Google Play,1.0,1,"kan inte söka på låtar, kan inte trycka på ""mer""-menyn för att köa eller sätta timer. Vad betalar jag för????????",2026-06-19 10:44:50
c1077453-5d7b-441d-8e23-e6de5d5dd3d8,Ethan McCauley,Google Play,1.0,0,dope,2026-06-19 10:44:42
3e99ad48-7ea8-445b-a2a7-f0427b179407,Smihc Ninek,Google Play,5.0,0,I genuinely love it 🙌,2026-06-19 10:36:00
36eb54c8-5452-4abd-a489-979d36363203,Divyansh Yadav,Google Play,4.0,0,this is good and I love it,2026-06-19 10:35:31
4c4ecf21-4adc-4606-a128-fc0f4a29594e,Soni Kumari,Google Play,4.0,0,it is ruling on my liked song,2026-06-19 10:33:33
dd8c7675-63d6-4ad0-ab06-10cb6c14eef5,Lord o' Cheese,Google Play,2.0,0,insanely unstable recently and far too many annoying ads trying to force you into buying premium. used to be halfway decent,2026-06-19 10:33:13
3ce0edea-3953-4b53-a9e7-88618a5044a2,Krishna Kesarwani,Google Play,1.0,0,Can't even listen to songs you like anymore more than once a day just because you don't have premium,2026-06-19 10:31:05
61f5d360-9df3-42c8-86de-a6b4384bc4f1,A Google user,Google Play,1.0,0,have no idea wht this is but problems i didn't download it need all of these deleted only the original app,2026-06-19 10:29:56
258f966e-2962-49f1-b7d4-a2898c3d22aa,Kagiso Jorosi,Google Play,5.0,0,Great features,2026-06-19 10:28:44
495e74b3-966c-498d-9dc5-fda9df29fb0d,Alberto Valle,Google Play,5.0,0,best.,2026-06-19 10:26:21
ed7862e8-6bfb-49ab-95e8-9a48bbe2444d,Ayan Khan,Google Play,4.0,0,this is good to play game with song i like it and everything have to play song i like it idk how much. time I said but I really like it,2026-06-19 10:26:14
ae09c47a-4612-4f65-821c-f46efcc02003,Roberto Naherajr,Google Play,5.0,0,I really recommend this app to anyone I like the way a work and make me happy to have Spotify thanks and give a good use please 🙏,2026-06-19 10:22:37
917ac4df-19fb-4ff5-b3c4-ab3bcb3e61eb,Priyanka Das,Google Play,5.0,0,good apps,2026-06-19 10:16:11
d73bccc3-1976-4502-bfc6-59e10809c4d0,Esau Ramirez,Google Play,1.0,0,ur new update on consoles like ps5 broke the spotify because i will play manually play the last song i have on my list and it will do the one before that idk if its the fact that the ps5 and phone updates are different because they are linked to the same account.,2026-06-19 10:09:38
b2e84cbe-ef8b-4214-be2b-b721919998b7,AYUSH RANJAN,Google Play,1.0,0,it is very bad app kyunki ismein ab gana chalane ke liye bhi paise mang raha hai Sabse bekar app hai,2026-06-19 10:08:52
2ee03908-7254-4e26-8fd3-fe13ff434cd3,Bryson Knudson,Google Play,5.0,0,Great App. No annoying adds or anything. I love how I can download songs and play them when I'm offline.,2026-06-19 10:06:42
a2e79c0d-ce6f-4fe3-a0d9-aa21dc958545,sumona,Google Play,5.0,0,joss 🔥🔥👑,2026-06-19 10:01:55
aa866711-e53e-4cc6-8dcf-467269917f9f,Rudra Shankar,Google Play,1.0,1,i am a premium user but my friends who are not paying for the premium are not even allowed to jam together and after removal of the 5 person family plan the appeal for premium is dying fast music should be an activity to bring people together and to enjoy together not dj alone atleast basic features like queuing music and selecting what you wanna play should be free along with jamming capabilities so we could share music everyone and not just the premium buyers What a let down !!!,2026-06-19 09:58:34
9393ed71-bd99-4d53-93e6-1df52cab3160,Sophia Hamrah,Google Play,2.0,0,"I could you not, I get 2 minutes off of music cuz the ads. Theres like 4 ads every 2 songs. Like why would i watch ads when i could just listen to music and give this a proper 5 star rating?",2026-06-19 09:58:06
913cd224-698a-4172-86c0-a8037f17309c,Kabo Knowledge,Google Play,5.0,0,Even though I don't pay premium I enjoy using it more than I thought I would,2026-06-19 09:57:39
c803005b-118d-42e6-8999-144e4667ff2c,Maria Only,Google Play,1.0,0,when music is playing nothing there isn't a notification for it nor on my lock screen to skip,2026-06-19 09:54:54
6eab6ff8-4368-43e3-8286-2b9378385403,Aidilpon Dekli,Google Play,5.0,0,Spotify is an excellent music application with a wide collection of songs,2026-06-19 09:48:59
fc3df93a-cbad-4a7a-8b90-ee9f3d5b6325,Pratima Namdeo,Google Play,1.0,0,so bad or worst after few days it asks for premium and you can not play song of your choice even if you make playlist😠😡🤬you would face several long ads even in a 2min song,2026-06-19 09:46:04
a0431a65-4cfe-45f6-934b-2f4f429f3581,Mantun Kumar,Google Play,5.0,0,can't say anything. it so good 👍,2026-06-19 09:42:51
3b091815-dd53-4d29-a028-fc1c6f96a7bb,Janice franklin,Google Play,5.0,1,I love Spotify great music still the best music app to have on ones phone,2026-06-19 09:42:47
9acde09f-8d22-4fa1-a8f2-79f62142caa3,Tomohiro Zachary Reyes,Google Play,4.0,0,WHERES THE CROSSFADE 😭😭😭😭😭,2026-06-19 09:40:02
dba17387-2066-45c1-870c-d5caa8173526,Milo Wood,Google Play,5.0,0,very reliable,2026-06-19 09:36:10
63fd3c94-e09f-408c-8218-2db648cb1c04,Elorm Brain,Google Play,5.0,0,Great,2026-06-19 09:33:50
70d76764-2b2c-4d56-a542-34afe0ceffe1,Anant,Google Play,1.0,0,"Spotify used to be a very good app, but now its just rubbish",2026-06-19 09:33:20
d7cfc859-fcb3-41ce-90c9-b2c4d7576f02,Guy Goza,Google Play,5.0,0,I'm ready to vibes and nice music 🎵 thanks,2026-06-19 09:30:54
5cbc1b95-63b5-40f7-bd5c-9a405ab8c03b,Thadsi Thadsigan,Google Play,5.0,0,this is good 👍,2026-06-19 09:26:00
4c37a7e6-cb95-4c13-a0cd-b01bf6893cd9,Dhruv Prajapati,Google Play,4.0,0,"Very glitchy, disappointed Edit- I'm using it as my daily driver, but sound quality is not appealing at all. And will glad to see better equaliser implementation in this app",2026-06-19 09:20:01
5cc684c2-3bc2-4b74-acbd-cbdc9d17e03b,Ragini,Google Play,1.0,1,"It's crazy how much the app degraded. You have a limited number of skips, advertisements every few minutes and now you can't even play the song you want or your songs in an order you want without premium. Better to avoid the app and use something like amazon music before your taste profile is already set.",2026-06-19 09:19:30
9c5dc5e7-c756-428b-8588-f9304767a376,Winfred Moore jr,Google Play,2.0,1,keep shutting down not responding update fixed the bug issues,2026-06-19 09:14:08
efd8c5fc-cde0-4fa0-aa88-de956f3c571d,Nana Abc,Google Play,1.0,0,"Please stop telling me to update to your new widget when it periodically goes offline and I can't even do anything to open it from your new widget. I have to go to my app and open it, then what's the point of using a widget to open up Spotify? Give me back the option to use the old widget, or fix your new one.",2026-06-19 09:12:01
d2b8083c-af2e-4321-8e5d-b642b4597b43,R A,Google Play,5.0,0,Very nice app,2026-06-19 09:11:02
600a13dc-213b-44cb-9f1d-03ef1c2f8608,ucingpeot23 Ucingpeot23,Google Play,5.0,0,if I listening Spotify music I so relaxed,2026-06-19 09:09:19
5bfd63ab-8d42-46b3-9e86-1c14c1458d99,Daniel Anibarro,Google Play,5.0,0,"whether you agree or not..this is the most complete music streaming app in the world, now that they have the ""lossless"" audio quality it just can't get any better",2026-06-19 08:56:51
dc8e15aa-a385-4563-8004-cdd61cd10f07,Muhammad Ahmed Awan,Google Play,5.0,0,Every Song Streams show will make Spotify more Powerful,2026-06-19 08:51:02
b7200e7e-8b86-4481-9486-add1c3910a35,Manoj Sarda,Google Play,5.0,0,Thanks for making music available,2026-06-19 08:48:54
b73b9eff-8a9a-497f-a63b-ac09a6e4c347,Aditimishra2006,Google Play,1.0,0,it's to much ads,2026-06-19 08:43:27
ade404c1-84f1-4ed2-839b-c3c4cb12e6c9,Jason Adkins,Google Play,3.0,0,stop trying to make me use the new widget! The new widget sucks.,2026-06-19 08:42:48
f7197cb1-20e8-4aa4-acaa-7de4f9bd4dca,Bobby Kale,Google Play,5.0,0,beautiful app 5 star ⭐👌🏻🥰,2026-06-19 08:41:23
fd370983-9b3a-4983-9ffb-bee2cd7a3bd4,Nabin Paul,Google Play,5.0,0,It is so good 💜💜💜💜💜👌🥰🫰🫰,2026-06-19 08:40:16
9b70c75b-9a45-4416-affb-b3e64dd40d55,Danger Stout,Google Play,1.0,0,Wants me to get premium for everything I was listening to music and I chose a song and it said to buy premium for listen to any song anywhere remove this feature it's just gonna make more people uninstall the app,2026-06-19 08:38:55
a9818e4b-c16c-44f3-a791-7a0ba45ff384,Wade Hunt,Google Play,4.0,1,the new widget sucks. it's bigger and removed the play button for no reason.,2026-06-19 08:37:48
07fe8d43-1c28-4031-84a1-acb5f35b2799,Paresh Mahajan,Google Play,5.0,0,🔥😍,2026-06-19 08:36:24
d1fbdd4b-bca5-4a91-b69c-be4e85e6e7c6,William Hewitt,Google Play,3.0,0,your new widget never loads and it won't let me use the old one,2026-06-19 08:33:34
31dda810-797d-4731-a5ec-9ea229c29046,Ricardo Jonathan Moreno Gomez,Google Play,1.0,0,"BRING BACK THE OLD WIDGET RAAAAAH! THE NEW ONE F SUCKS. The previous widget won me over with its simplicity. The new version adds features, but in practice it's clunky and less useful. My listening time fell from 1,300 to 600 minutes because I end up bypassing the widget entirely and going straight to the app. The biggest annoyance? The old widget constantly nags me to switch to the new one",2026-06-19 08:30:10
a2b0e82c-247e-4ea5-8e95-2a00310fd49c,Selvi Zahir,Google Play,1.0,0,"so bad, to listen to a music we need to watch full 2 ads first, its super annoying. I was there to listen to music and not wasting my time on the ads, pls fix your ads problem, spoitify.",2026-06-19 08:30:07
3867ae8a-5dcf-493f-ac23-806dd93256f4,anudeep sumanth,Google Play,5.0,0,excellent performance,2026-06-19 08:24:29
6bac4799-59b8-4dde-b8d9-34a21533fce4,Billy Yawn,Google Play,5.0,0,it good app,2026-06-19 08:23:01
221554ad-6d80-424a-a3fe-784fc9bbb477,Tony Tequila12Tunes,Google Play,5.0,0,Spotify has my music i create,2026-06-19 08:14:34
2835f470-8bab-46fb-8214-15ea54a6846b,Shiva Rawat,Google Play,5.0,0,this is good app,2026-06-19 08:06:43
73bd2b0d-236b-4cf8-9878-1429eaff6863,Sherry W,Google Play,1.0,0,"I have been using Spotify for several years now and I have come to the realization that it is another victim of shitification. It was a beloved music player once, but now all it does is lag. It is incredibly buggy and doesn't work half the time. I have to restart the app over and over and over again just to get my liked songs, the songs that are downloaded to my phone, to load. I don't understand why I have to wait for downloaded songs to load if they are on my device. Pathetic",2026-06-19 08:05:49
f66e8722-2137-4084-891b-56f434f71f78,Starbust. Bun,Google Play,1.0,0,a billionaire company doesn't need to be giving 4 ads every two songs,2026-06-19 08:01:52
77d3ca2d-be09-49c3-b3e2-a8c0cecdca5f,Jamal Hurley,Google Play,5.0,0,Love this app. So many great songs and Playlists. I love the fact that you can create your own personal radio stations based on the genre of music that you like 👍,2026-06-19 07:59:48
c4d9e1ea-78f5-40da-bf51-eef12f23ccd6,Arianna Donaldson,Google Play,2.0,1,the free version is horrible I am unable to pay for premium features and I have to deal with the free version you only get 6 skips an hour you can't change the queue you can't go back to a previous song! ...at least give us the ability to change the queue + go back to the song that just played at least the ads are bearable for the most part tho edit: WHAT THE HELL I FOUND OUT THAT YOU CAN'T EVEN CHANGE THE ORDER OF THINGS YOU PUT IN THE QUEUE AT LEAST LET US CHANGE THE ORDER OF WHAT WE PUT IN 🙏,2026-06-19 07:57:58
f1cdc8c3-40e5-4b60-8781-497aeb477d8f,Sugan G,Google Play,1.0,0,"Spotify has increased their prices too much. Request to bring back the price. I had switched to apple music. it provides affordable listening experience. with lossless music. but the suggestions in Spotify is good that i feel like coming back, if the cost is affordable",2026-06-19 07:52:45
ab7a1249-8d6c-4d83-9f97-32ba1fa5e295,Jack Hill (Just Jack),Google Play,2.0,1,"Basically everything it seems in the app at some point is blocked behind a paywall or just blocked in total like shuffle options and stuff like that, and 6 skips an hour? thats just bs. Prolly one of the only negative reviews and please FIX THE XBOX VERSION ITS SO BROKEN I DONT UNDERSTAND HOW YALL MADE IT!?!?!",2026-06-19 07:52:20
ae46b470-6acb-454a-8b9d-f61f2cad51e5,Sean,Google Play,1.0,23,New widget is terrible and they force it on you.,2026-06-19 07:48:52
205db065-6e31-4154-8355-105bbdf58c6f,Nicholas Natividad,Google Play,5.0,0,Spotify is dope!,2026-06-19 07:48:11
736215ce-cfaf-4d2e-bd8d-add9f2e46ff5,Higranx,Google Play,5.0,0,aplikasi bagus tpi iklannya banyak bgt,2026-06-19 07:47:39
bd6c262b-9c10-4374-ac23-ed200951525c,Libtekhed,Google Play,1.0,0,Your new widget doesn't work on my phone but you keep overwriting the old one with update messages so now I use YouTube Music. Good job. edit: nothing helped. It's the king of bloat.,2026-06-19 07:47:06
cda5be24-23f3-4c6a-9a5a-1d91b694565c,Manirujjaman Mondal,Google Play,5.0,0,Listening to music on Spotify is much better than listening to music on YouTube.,2026-06-19 07:41:33
ef9a6036-83c3-4c2b-8b39-cf2ac1461fbf,B F Currie,Google Play,5.0,0,Great still after 5 years.,2026-06-19 07:39:32
6c78f11c-a763-4b92-b303-fe1f1f01aeaa,Toni Phillips,Google Play,5.0,0,10/10 do recommend. it has every song that I like,2026-06-19 07:24:26
bb2de9b7-31e1-4d4d-8e1c-f40812fb7f39,Omer Bangash,Google Play,5.0,0,so cool!,2026-06-19 07:23:28
c9a2570b-1219-44be-87a0-1266c661bbe3,Karl Calkins,Google Play,1.0,5,"I pay for Spotify. When it gets updated I loose liked songs. It's song types like ""rock"" or country or something like that is completely random for what it classifies as a style. I gave a very critical review of this app before but no surprise the review disappeared. I'm actually going to stop paying for this app, they don't pay the artists for the songs, increase how much I have to pay and I loose my likes and play lists so seriously why would I pay for something that doesn't deliver?",2026-06-19 07:22:31
170aa224-974f-4fe7-9d7e-4936ed52ee90,Trevor Bowman,Google Play,1.0,1,why remove the small widget? No one wants half their screen taken up,2026-06-19 07:22:25
274ca4d0-8867-43b2-8b62-1d8633732801,سعد عبدالعزيز,Google Play,1.0,0,التطبيق حلو جدا بس للأسف انا مش عارف اشحن البريميوم لا عن طريق الفيزا ولا محفظة اورانج كاش مع انه مكتوب انهم طرق فعاله ف بسبب كدا مش عارف استفيد بالعروض نهائياً بسبب انى مش عارف اشحنه فارجوا ان المشكله دى تتحل ...,2026-06-19 07:22:07
c2b9c882-4126-4d95-a5c8-9901133b5441,Rocky Villamora,Google Play,1.0,1,"Ever since the latest update, the app keeps crashing. I'm paying for Spotify, so if they don't fix this soon, I'll have to move on to YouTube, which is a shame, since all my music is organized on Spotify.",2026-06-19 07:19:41
52f98713-270a-427d-b921-5c457ea60c1f,Kirsty Thomas,Google Play,5.0,0,Couldn't live without Spotify,2026-06-19 07:16:16
dcbe9da6-0d9c-430c-8f91-35fc2ae108d3,Ollie Bielat,Google Play,4.0,1,Great music app if your willing to pay. lots of settings to make your music sound good but one thing it randomly stops playing music and loads for like 5 min or more. and Its not my internet cause I had 4 bars of cell service.,2026-06-19 07:11:30
c774b9ce-b1f7-4760-b6ca-c04e518a23b0,Austin Underwood,Google Play,1.0,0,Use to be the best but now with the dj and enhanced shuffle and other annoying things i cant trun off adds more lag as well as an increase in issues and problems with the app. So much irrelevant stuff now on the main page and I can't even find new music from artists that I follow anymore seems like a basic thing that should have stayed in the app No clue why they got rid of it but the moves that they're making make me want to move to a completely different music app rather than paying for this.,2026-06-19 07:09:56
2c15ec18-fef1-4c48-a018-f0f964df0321,Wisdom Sampson,Google Play,1.0,0,I'm a premium user Spotify deleting my downloaded song and I'll download again thru the still do same thing,2026-06-19 07:04:36
