Review_ID,User_Name,Platform,Rating,Thumbs_Up_Count,Review_Text,Date
127afc83-1cef-4cfe-a06b-55f0cde79ef2,Pandya Harsh bhai,Google Play,1.0,0.0,ads are killing vibes,2026-06-21 10:04:00
71b10650-8988-441d-8c85-48b5999be765,Shaqila Orlin,Google Play,2.0,0.0,"it's Horrible. Ads everywhere, And now you have to pay to listen too songs on repeat, unless you have a huge budget income. i would recommend but if you're on a tight budge i wouldn't do so.",2026-06-21 09:43:50
59b3bc62-5ac9-4267-8dc1-d1c41e48db00,Matt Hite,Google Play,1.0,0.0,"one star purely because you refuse to fix whatever is wrong with ""shuffle"". it's been broken for years. 800 songs, yet it plays the same 25, over and over and over.",2026-06-21 09:39:41
fbe83160-fca6-42d8-90e2-90b02cc75351,Robinson Rongpi,Google Play,3.0,0.0,ad is soo frustrating 2of 2 at once is okay but after 2 of 2 ads again 1of 1 ad use to appear it is really frustrating what if you're depressed and you want to listen to a song but stupid ads pop up. your ads speak about how frustrating ads are but you're promoting hundred of ads wow,2026-06-21 09:29:40
9696d38c-978e-448f-bb8a-cdbab6a01e2d,Dan “dans88” S,Google Play,1.0,4.0,"Since the latest update, it becomes so buggy and constantly crashing, it's useless to use. Also, why does it switch to different listening list when the current play hasn't finished? This always happens when I stop/pause the current one and wanting to play again after minutes or hours later. why can't I hear anything?? Just craps.",2026-06-21 09:21:05
cca84175-f4f1-47a9-ac4c-6d572c8f8178,Jordan chiles,Google Play,4.0,0.0,"loved this app but couldn't afford premium, 😕 that's personally a me problem and I think the app is amazing and I would recommend it",2026-06-21 09:16:22
4f7b535a-866c-4c9a-97b7-6304f3c2dd26,Vhie Camac,Google Play,5.0,0.0,actually so good and lyrics are accurate,2026-06-21 09:16:09
81d460d6-7ae0-471d-83e0-c862074cf805,Am,Google Play,1.0,1.0,They did something with the widgets and now I can't have my 'now playing' one on the homescreen without adding another one?! The UI is also becoming worse with every update. Adding a song to a playlist has become a 30 second nightmare when before you could just press a few buttons and done! And the Ads make the platform unusable. Can't go more than 3 songs without having to leave the app for the day...(by that I mean I'm not listening to 4 Ads like I haven't got anything better to do),2026-06-21 09:15:35
88f6f2ab-2b1e-415a-b10f-e7e205c0e8d1,인간사랑,Google Play,4.0,0.0,"Spotify is one of my favorite app🎀 like it's recommendation are absolutely accurate,the only concern for me is that after every 30 minutes there are absolute 5 non skipping ads I really hate that like it just change the mood of listening to the song..",2026-06-21 09:15:31
dc327bf7-622a-4904-b965-e65fff97b377,Mattias Isaac Alejandria,Google Play,1.0,0.0,"This app is so laggy and heating phone background, it's recommend high storage cellphone, except in 64G cellphone, because it's lag.",2026-06-21 09:06:38
aa565500-85de-42f4-a25c-b01a5fad5b4a,Li Sunji,Google Play,5.0,0.0,"Spotify offers an amazing music library with excellent recommendations. The app is easy to use, and discovering new songs and artists is always enjoyable.",2026-06-21 08:57:32
a91ae5a6-fe4b-48fd-a78a-9e5ad607c20c,Echo Searls,Google Play,3.0,0.0,I love but hate this app I don't like that I need premium for everything and that I need premium to go back and listen to a song again.,2026-06-21 08:56:55
27932e22-7f74-4ee5-b68e-a15165550a77,Aavya Chaudhary,Google Play,5.0,0.0,enjoying the vibe of your liked music,2026-06-21 08:44:42
69af59c7-2b85-4f0b-a3ed-7cb55a0220d7,Abbos Xudayberdiyev,Google Play,5.0,0.0,you will not liseten to music you will listen endless adds,2026-06-21 08:26:14
d418ef95-5833-483b-a51d-295800c04246,Treasure Beregha,Google Play,2.0,0.0,"I am having trouble loading the app it says something went wrong, I have tried Delta the app then downloading it back it still doesn't work now I am logged out of my account and can't listen to music. I am very dissatisfied and disappointed with this update",2026-06-21 08:10:23
2fce5313-84ce-4713-8ce4-60df42de650b,Daniel Elizondo,Google Play,5.0,0.0,it keeps repeating the same music and the same playlist,2026-06-21 07:52:13
637d3a28-f911-4124-a19e-20c109a7f110,Evelyn,Google Play,1.0,0.0,"it bad it was my money It forces you To listen to Song says not in your playlist And A lot of the songs That I encountered Suggested things That no minor Should ever hear And then it shoves premium Stuff, in my face. Do not install This app What it will do is Let you build up a good Playlist. And then Take it all away And then Demand you get the premium This app sucks.",2026-06-21 07:48:35
249e074e-880f-4f7d-998f-f5aa91bc29b4,lily warren,Google Play,5.0,0.0,"Great music listening app, love it",2026-06-21 07:33:28
4ef5b513-e773-48b7-b866-a9f591b78cd2,Treasure Smith,Google Play,5.0,0.0,i like to listen to music,2026-06-21 07:28:19
6705c43e-5bd0-49e9-9d64-c3ba9bd2452a,Alejandro V,Google Play,4.0,0.0,I just love how mostly all songs I can vibe with are just on this app,2026-06-21 07:01:38
44d07be5-feae-4c41-a7f8-6303b3e912e7,Calei Dixon,Google Play,5.0,0.0,It is a very nice app that allows you to listen to whatever topic of music you want.,2026-06-21 06:00:32
465a7878-6c23-46c4-9e6b-aeec2d0bbca8,Mail,Google Play,3.0,0.0,Love its convenience and large access to music. If it could cut back down to 2-3 ads every few songs and give me half an hour of uninterrupted listening again it'd be perfect,2026-06-21 05:35:37
dcf6e205-ea53-40c3-90fc-63671d448bc8,Ahmad Fitry,Google Play,5.0,0.0,"App wajib ada dalam fon! ""Layan gila Spotify ni, terutamanya playlist 'Discover Weekly' dia. Macam tahu-tahu je mood kita tengah macam mana. Kualiti audio pun mantap, lepas tu boleh download dengar offline masa drive atau joging. Tak rugi bayar premium bulan-bulan, berbaloi teruk!""",2026-06-21 05:27:46
d33862e4-896e-41e3-8e90-c43cb1f97629,Destiny Thomas,Google Play,5.0,0.0,the best music app In the world because you have more options and create your Playlist.,2026-06-21 05:22:24
da34ace5-509b-4373-a59e-56d2107957ae,Bodine Atkins,Google Play,5.0,0.0,I love your app so much it is amazing but can it be like free so if I go on a trip I can listen to it and not need wifi to listen to it please thank you,2026-06-21 05:16:00
c03fc753-4a6f-4a09-bc44-b3af1e961b94,GreasePolice,Google Play,2.0,1.0,"I have been happily using spotify since its creation for music streaming and have been very happy up until now. For the past few weeks spotify has been crashing, frequently seemingly without reason, I could be adding a song to a Playlist, changing songs, or just doing nothing and listening to a song and be halfway through and the app will completely close. sometimes when I reopen the app and continue my song it will immediately crash again. This has become increasingly frustrating to use.",2026-06-21 05:10:59
9017a2f3-161c-4253-b38c-650969474c64,Bre Martin,Google Play,1.0,0.0,I want to listen to the songs on my playlist not recommendations. after all that's why I made a playlist of songs I want to hear.,2026-06-21 04:06:04
6b87bbf0-a139-4d04-934c-47c74d77efda,ken saro,Google Play,5.0,0.0,topnotch playlists,2026-06-21 03:58:14
dce882a5-d62c-4118-ac40-149c88c5aade,Abigail Laird,Google Play,1.0,1.0,"I've used Spotify for over 10 years. i remember when you got 1 minute of adds every 30 minutes on the free version. ive paid the subscription for most of those years, but i can't afford it anymore. went back to free, now its 1 to 2 minutes of adds every 2 songs. so every 6 minutes there are 2 minutes of adds. its disgusting. its predatory. this billion dollar business has no reason to put adds this frequently. i feel like listening to music and i think ""nvm the adds are too much"". bad company.",2026-06-21 03:55:50
f89e9dfe-f5dd-47cf-9323-f9be3be2ae4e,Philip,Google Play,5.0,0.0,my experience with Spotify is that Spotify is very intuitive to your music listening needs and if you take the time to give it some true input you'll get a true output that is perfectly suited for your listening purposes,2026-06-21 03:12:58
602fec06-38f5-4368-988f-5be9c4cc0b48,G G,Google Play,1.0,1.0,"looking through some reviews having the same issue. why do I have to reinstall in the first step. why do an update and mess things up. I was thinking of getting premium, again but those customers are having issues, too. Pandora, maybe? But I don't like their premium because it changes my music lists. iTunes, I guess and find my old ipod.",2026-06-21 02:58:46
aa55f2e9-7ebd-499e-a38a-9ecc291ea6eb,Navdeep Kumar,Google Play,5.0,0.0,some more work can be done on shuffle,2026-06-21 02:53:55
83893704-798e-49c7-8f42-09495f8b8fdb,Elliot Class,Google Play,2.0,0.0,See don't get me wrong I love using Spotify but you need premium to do basically anything! Want to pick out a specific song? You need premium just to do that! Honestly Spotify is trying to do anything to have people buy premium. The people who have free accounts can barely do anything but just use shuffle and select very few songs.,2026-06-21 02:31:59
24743725-1992-4f93-99b4-4145b9faa6bb,Caleb,Google Play,5.0,0.0,"This app is really nice because of it's trilling features,from music listening and the rest. And I really like it because it gives me all my gospel song that I love. From great Ministers and the rest. Nice work guys 😊.",2026-06-21 02:18:48
f378345a-015a-432a-a1a1-7b6dd5f96418,Ankit Parmar,Google Play,1.0,1.0,there's just too many ads I mean after every singer song that's just too much and they say we only give ads every 30 min and ads aren't even that big problam i can just listen to ads but even after ads Spotify won't let you play mores then 5 songs and then it operates onto shuffle cabt change the songs you likeyou have to change this and stop forcing premium on us yiu already make that much money from the artist 59 to 60 percent revenue,2026-06-21 02:12:59
3e55319b-1a64-4fed-b99c-6aca75f333a7,Prentice M2,Google Play,4.0,0.0,Spotify is actually one of my favorite programs to listen to my podcast shows but as of late there is something wrong with the app where it shuts off after a min for some reason.,2026-06-21 02:00:31
0c12b9dd-46c6-464a-988e-469f31308600,Vanesa,Google Play,1.0,0.0,"This app is generally more frustrating than any music player I've had. Basic features like deciding if you want the song on repeat and going backwards is behind a paywall. Another song immediately plays afterwards and it's not even from your album or anything. It's a random song you never picked and then you have to go to your favourite songs and tap them again, only to be met with 4 ads in a row. I'm not paying for an app to have BASIC features that any other music app has for free.",2026-06-21 01:56:27
eb6b4fb9-e464-4e36-ae59-8da950d2043f,Emalee Williams,Google Play,5.0,0.0,I love that Spotify let mee import my YouTube playlists. I'm loving this app,2026-06-21 01:48:55
65441689-84bb-4d1d-8f56-c7903faca370,Helen Moore,Google Play,5.0,0.0,"Having all my favourite songs and so much more is great, exploring recommend songs or looking and listening to songs similar to my favourites I absolutely love Spotify ❤️",2026-06-21 01:48:01
c311a21c-c9bf-4c8a-ac87-b70e334386da,Tracey Smith,Google Play,1.0,0.0,"Used to be great, not so much anymore. I'll start with saying I do create with AI but I'm very transparent about that's what it is. I have my playlists and up until recently loved Spotify DJ to discover new music. I'm listening today though and it's stuck in an AI generated song loop. Before if I got bored of a genre I could skip a few songs and it would change the genre. Now it just keeps spitting out, and I hate this term but it fits here, AI slop. I should be able to skip the AI songs",2026-06-21 01:46:01
80d9ecb1-caa2-4bba-a0d1-d4b3688b682b,Alistair Murphy,Google Play,5.0,0.0,greater music my favourite people do podcasts and music thats just all tf app🥀🥀🫩,2026-06-21 01:26:27
e705b318-be96-49bf-a0fc-a012757ab5a2,Candies Thonga,Google Play,1.0,0.0,it doesn't let me choose the song of my choice because I don't have premium and I never had a problem with listening to ad's,2026-06-21 01:12:30
f1d134c2-a553-4853-83bf-751a017c971a,Tony Duddridge,Google Play,5.0,0.0,Literally the only app to stream registerred music tracks. Spotify rocks my socks off. SoundCloud for the EDM and remixes 🤘🤘 ****10 years and yall still rock my socks off,2026-06-21 01:03:36
397017b5-a765-43c6-87a4-27a71e867f29,Harry Lord,Google Play,3.0,1.0,please for the love of God fix the shuffle. I swear im experiencing de ja vu multiple times as its always the same selection of my liked songs shuffled in the same order multiple times!,2026-06-21 00:51:28
fbbf377c-89ed-4fa4-bac6-1473a606ccb6,Brandie Earl,Google Play,2.0,0.0,"Free podcasts are cool, that's one of the only upsides though. Theres a new issue every month. The episodes are constantly glitching and restarting, after I've finished an episode,it will restart, and when a playlist I've downloaded ends, why would you try to play music I don't have downloaded? I just end up listening to nothing for the rest of my shift. The subscription is always going up while there are issues that just keep ruining the app for me. Not worth it at all.",2026-06-21 00:27:59
cc432088-4de0-44bd-83e3-f9bfc9343edb,Richard,Google Play,1.0,4.0,More ads than my local radio station.,2026-06-21 00:24:07
984ca664-fabf-4b59-a976-af5eb2af0746,Perid0tStar,Google Play,5.0,0.0,I love this! I can listen to so many podcasts while I'm stuck wandering around doing chores 😁,2026-06-21 00:01:19
da169b89-ccef-4e57-84d1-c3f002947632,Leila Perkins,Google Play,5.0,21.0,"I honestly think this is the best app for music! Not that I have really tried anything else, so I may be biased. Edit: they added the option to select songs within a playlist! :D But I would also like the ability to add notes to songs, I don't think it's fair that only the AI can do that in prompted playlists.",2026-06-21 00:01:17
870e5c0c-7000-43e1-9cc3-d813e2d7da9e,Jaya Krishna,Google Play,1.0,0.0,even user can't select the they want to listen,2026-06-20 23:48:35
a2b9378f-c6de-4a89-8b3b-43408b6af590,Jonathan Zulu,Google Play,4.0,0.0,some of us don't have all the features imagine I pay for premium and I can't watch videos and we need more sound quality. also just make it easy to use and apple automix sounds better than our mix people are laughing at us so let's improve Spotify.,2026-06-20 23:47:11
f6dfc10e-89fd-4906-af68-5295fc5253ec,Ace Lee,Google Play,1.0,1.0,"I've been a premium user for about 2 years and I have some complaints. 1.It's so SLOW! it takes about 5 mins for the app to load and another 3 minutes for my playlists. 2.It's buggy. Sometimes, my queue list doesn't allow me to rearrange my songs (which is a premium feature I paid for). 3. Sometimes, it sounds so sharp and not a very nice quality. At this point, the price is not worth it for the issues this app has.",2026-06-20 23:41:11
27ed2a2e-4971-4a8a-9080-95ceb783df31,Orion Crawford,Google Play,5.0,0.0,I just got premium for Spotify and it is amazing I just downloaded a playlist that has 81 songs all 3mins or more in length and they are all offline music and ts is such a great app even without premium,2026-06-20 23:35:29
69ef0be8-57e7-40e0-be06-658721a6c222,Bev Spreeman,Google Play,5.0,0.0,I love the other movie themes they added to my choice of MAN FROM SNOWY RIVER. wonderful music. I listened all day.,2026-06-20 23:14:27
debe41cc-7814-4f95-9950-2546a0b8041c,Darshil,Google Play,1.0,0.0,"i have start to hate Spotify from the my heart this much ad is so frustrating, very disappointed ☹️",2026-06-20 23:10:36
fb4b017f-20a6-4fd7-92e9-96eadb5aadd9,Garvit Puri,Google Play,5.0,0.0,I got very relaxing songs when I played in smart shuffle and my stress gone and I enjoyed the feel of songs.,2026-06-20 23:04:42
cc2aa443-e68e-412a-af73-1c71174c33bf,Stephan Bassmer,Google Play,4.0,1.0,"On PC the free version is awsome, yes youget packs of 3 ads every 10 songs but it's still good. On the other hand, the mobile version is so bad, it literally forces you to have premium to chose which songs you want to play. Otherwise it's always on scramble, but that scramble ads the recommended songs to your queue.",2026-06-20 23:00:49
d882a215-2a72-47bd-bfd2-712c8bd2d378,Tapan Mahato,Google Play,1.0,0.0,now you can't even search and select music? what's even the point lol,2026-06-20 22:47:11
8df7fffc-8384-4d3f-a32a-1717b08d04de,Vani giduthuri,Google Play,1.0,0.0,"Worst, can't even choose what song to listen next, only 6 skips per hour seriously, better to buy youtube premium then this.. It's too much to push buy premium, better to uninstall all.. So they get to know.. Don't forget we can still download songs on our devices",2026-06-20 22:44:49
ecb53cfd-7f71-487a-bc6a-7068020e5de6,Liam Tetrault,Google Play,5.0,0.0,"very easy to use, my favorite music program! 5 stars definitely recommend!!!!",2026-06-20 22:38:47
69a3caae-3908-4909-9723-ad5393c892f6,Sharon Laminga,Google Play,3.0,0.0,it was nice i got to listen to my favourite songs,2026-06-20 22:37:52
6a37c62e-2ed8-4ca3-a767-53d80e7444cf,Sky N,Google Play,2.0,1.0,"Used to be good, I've had Premium for years. With the recent updates, the app crashes so much I can barely use it. All of my local files have disappeared completely and the music glitches often. Updating this after Spotify replied because I can't respond directly. I've tried uninstalling and re-installing, restarting my device, updating my device AND Spotify, cleaning out playlists, everything I could do. I truly believe this is not an issue on my end. Spotify is 100% unusable right now.",2026-06-20 22:17:58
e3623b05-9ae8-42b7-86a6-ab02fd555dcc,Jimmy Hayes,Google Play,5.0,0.0,"wonderful tool for music , audio , podcasts , video , packed with years of enjoyment old , new .",2026-06-20 22:13:38
cb436051-a87c-4c1b-b5eb-f00a9a6348ee,Alaina Leighton,Google Play,1.0,8.0,What happened to the sort option for playlists?,2026-06-20 22:10:19
9b76bf6d-fb2f-426f-9e5e-42f2d2894daa,Elif Abdulbakioglu,Google Play,5.0,0.0,"A few months ago after an update Spotify stopped playing on my JBL go3, haven't been able to listen to music with my Bluetooth speaker since then. Spotify was showing like it's playing with my JBL GO3 but it was using phone speaker. I tried several things to fix it, nothing worked. Finally I uninstall and reinstalled Spotify, and it worked! 🤩🥹 By the way the whole time it was connecting to my car with no problem.",2026-06-20 22:09:54
ba2daff8-c3b7-4ba0-9e57-74b54c65f5d4,Bianca Rodrigues,Google Play,3.0,0.0,"uh.... I just wanted give some 3 stars, like this is started to give me ads when I listen in the car",2026-06-20 21:58:33
f728a7c6-e19b-4af6-97be-d86d34af1e04,Princess Feni,Google Play,3.0,0.0,"The updates are super annoying, now I'm not even allowed to listen to a specific song in my liked songs. I'm not even able to listen to a specific song when I go to a specific song creator but overall, it's a good app.",2026-06-20 21:53:56
27ca40c8-aa73-4681-a78e-2934b53650d8,Jamil A,Google Play,1.0,0.0,I cannot even listen to the music I want to listen to because this stupid mobile app AUTOMATICALLY shuffles and adds songs to your playlist. use the web browser instead because this is just so bad,2026-06-20 21:53:06
b078c8b1-3721-42d1-9121-524aa954c88e,mohamed althaf,Google Play,1.0,5.0,"ONLY AD's..Spotify is Worstify Better we can call this app as ""Ad""ify app""... Too many ad's and interrupting often as it makes you come out of the app instead listening music and forcing you to go premium membership as you can't forward/control the album while playing. Worst app. They say 30minutes uninterrupted songs but every 5-10min they itself interrupt and torturing for premium membership. This called atrocity. For just listening one song(very first song), I was pushed to see five ad's .",2026-06-20 21:42:05
9f27a4b8-400d-41e6-b0ee-2d7c646f812e,David Gasparyan,Google Play,3.0,3.0,remove recommendations from liked songs.they are worst. and I can't afford premium.,2026-06-20 21:34:17
2900260e-e615-4c13-bb6d-1110e2550a4f,Sairamakrishna “Sai ramakrishna” Aribolu,Google Play,1.0,0.0,greediest app ever i don't ask to remove ads but please remove that limit I listen very few songs that i like now I can't even play it and by the way you can ask to pay for premium but I am student and under graduation how can we. afford like that so far it's as stress relief app now it is becoming the reason for stress,2026-06-20 21:32:09
036db9a6-3e98-4ebd-8bae-91a34af4908d,Logan Currier,Google Play,4.0,0.0,"very good, I listen to Spotify a lot whether I'm on my way to school, at lunch, going home, or in the car going somewhere. Edit: songs are being removed from one of my playlists that I listen to a lot and the dislike ads thing doesn't even work because I'll press something like 'getting this ad too often' and I'll get the same ad again.",2026-06-20 21:25:56
550ddb63-5043-4638-8976-9bc38622d07b,Sharon Gomes,Google Play,5.0,0.0,"everything is amazing. when I graduate 5th grade, I will listen to this. this is number one 🤙😍❤️😍",2026-06-20 21:22:48
8ff18626-6c27-4aef-94dd-89b61497df2a,Stu Pedaso,Google Play,2.0,4.0,Love spotify and have been a premium subscriber for years. You can find just about anything you want to listen to on the platform.,2026-06-20 21:06:04
10514830-941d-4014-985e-27ed8008fb5e,Yashika Gurbani,Google Play,1.0,0.0,continuously adds after just 2 songs for premium then I think chlo I think it's ok but now they have stopped us of playing our favourite music without premium we can't play our favourite songs. why it's necessary to take premium it's our own choice to take premium or not why we have to pay money for listening toh our favourite songs.how can they stop playing our favourite songs. and they restricted 6 skips per hour. I am very disappointed and planing to switch over another music app.,2026-06-20 21:05:43
254beb0f-1493-4b67-b6ec-edcc148d3912,Big Mac,Google Play,5.0,0.0,you can find everything. easy to use,2026-06-20 21:05:28
44590e85-3d8f-49d0-8238-98f48f29ea33,Brian Schoenhardt,Google Play,1.0,0.0,app has always been buggy. now they released new broken widget. old one prompts to make switch instead of just removing. the new widget just spins like it's trying to connect or find something but never does,2026-06-20 21:00:54
f5a90255-ce63-4ef0-9664-4d906ec860cf,Claudia Annabelle,Google Play,5.0,0.0,it cool when mix the song,2026-06-20 20:56:11
af279f39-4b45-4cbe-9f0c-c73ab4ace967,afrin,Google Play,5.0,0.0,This is tooo good for me to hear when iam sad or depressed or feeling lonely🤌,2026-06-20 20:48:44
e2598380-8b46-40d6-b531-9f8020e7824c,nurnadhirah mohdhairul,Google Play,5.0,0.0,"Great app for listening to music and podcasts. The recommendations are personalized, and the interface is easy to use.",2026-06-20 20:42:29
8f89fbde-85b6-4158-aa65-a27d18523f5d,Siddharth Vinod,Google Play,1.0,1.0,can't even let us play what song we like after a while of playing music and also can't rewind the same song at some point without buying premium. Absolute rubbish,2026-06-20 20:41:25
f0c4e5af-7707-4e1c-9932-1d2dcff390b7,Kim Morgan,Google Play,3.0,0.0,"Why is Playing your playlist in order now a PREMIUM action, like bro just the other day I could play them in order, this is outrageous. I had so many outbursts thinking my playlist was broken.",2026-06-20 20:40:00
4a7771b6-b682-4b31-bb50-a3d47122fd2f,Kaniska Rajkumar,Google Play,1.0,0.0,The spotify was one of the best apps to listen to music but recently it's been a bother it closes by itself in the middle of playing a song doesn't open or play songs apparently there's a bug in the app which needs to be fixed I just hope this could be rectified immidetly please,2026-06-20 20:25:12
e43d6cd6-9b91-42bf-8683-cf7102feb15b,Kristian Wilson,Google Play,1.0,24.0,"since the newest update I haven't been able to listen to any of my podcast. I open the app an choose a podcast an it tells me something went wrong, try again an it doesn't work. Been this way since May. I guess Im gonna have to find a different platform because my podcast help get me thru a 12 hour week day all week and this just isn't gonna cut it not being able to listen to anything on here. Still having the same trouble since May, but I kept trying, at this point Im done with Spotify. Delete!",2026-06-20 20:17:30
cffe9f2d-0ab6-4e84-acd1-23443853c857,Bruna Bauler,Google Play,2.0,0.0,"Spotify allows podcasts to have ads in them even when you pay for premium. It's ridiculous to pay for something just for the platform to allow ads. This used to be fixable by downloading the episode and listening offline, but they removed this feature.",2026-06-20 20:16:09
e6a41082-1b35-4310-8383-c45f72a3bd54,George Copus,Google Play,1.0,1.0,"I've been having the same issue over and over on my PS5 of not being able to turn off the ""Shuffle"" option, keeps shuffling the Playlist, and that's not what it used to be. Used to be play one song then to the next but ad after 6 songs like advertised. I'm not happy with the update if there was one idk",2026-06-20 20:14:23
0fe88164-2268-41e8-8856-566f2cc84476,PàRãSh THãPÅ,Google Play,5.0,0.0,best for song listener,2026-06-20 20:13:25
5782c963-e335-4087-9f0c-0c040a1d47b7,prince meruga,Google Play,3.0,0.0,"the app is too good but it keeps saying take premium membership and that is also ok it is playing ads in between and I don't have problem but after sometime it is not allowing my to skip songs,play a song of my choose, not letting me to listen to my fav part of song.",2026-06-20 20:01:08
