Review_ID,User_Name,Platform,Rating,Thumbs_Up_Count,Review_Text,Date
2743bc96-8267-45c0-a2d0-300033ff660e,Saema Rehman,Google Play,5.0,1.0,amazing !!! just hasn't got all tracks I've searched for like remixes for example !! otherwise great 😍👍🏻👌🏻💕,2026-06-20 04:21:57
b2079aa2-13b7-4cb3-ae21-ede33b15ffd6,VIR,Google Play,1.0,0.0,"ads, and even we cant play every song just few in the day totally pay to listen app",2026-06-20 04:11:04
57485f71-07d6-44f1-8476-a0c003e7dcf0,Denzel William,Google Play,1.0,0.0,this app was so good before but now I can't even play music at all.Premium this premium that broo I just wanna listen to music,2026-06-20 03:49:55
fecc598d-cc6b-47bc-b38a-79659fbb440a,Hristo Traykov,Google Play,3.0,1.0,"What's the point of having 10 GB of your device's space taken by ""Spotify downloads"" if 60% of the songs get cut off and cannot be fully listened to when you are completely offline? Reducing rating until I see some offline playback improvements.",2026-06-20 03:22:59
57eb360d-c9b1-4530-a805-be4d57d82ff7,kim ellena,Google Play,1.0,0.0,"This app was great when I first downloaded it, but after a while of using it, the songs I had downloaded that used to play offline now only play with an internet connection, and also, when I listen to any song, I can't drag the progress bar to any part So I deleted the app and reinstalled it, but there was no change.",2026-06-20 02:46:42
1ddded8d-65a5-40d0-81e2-c5d020c09091,Sophia Unger,Google Play,3.0,0.0,"yes it has very much great songs, but i really hate that you have to pay to download songs or playlists. I think it should be for free do atleast download things. But except that really great app",2026-06-20 02:45:29
ab48972d-da47-4058-a9b6-9f32ddcef3e6,Setrion Hall,Google Play,5.0,0.0,100% recommended.,2026-06-20 02:36:04
79ab104e-1429-45cf-bd2c-71f137532ef5,Weam Alrousan,Google Play,5.0,0.0,I can listen while I am on a different app,2026-06-20 02:34:51
d3dda233-3495-4925-a278-32014ca5fb4d,Dario Nanbu,Google Play,1.0,0.0,App randomly stops playing songs and has worse song recommendations than pandora or YouTube. Being able to play music consistently is table stakes and it can't even get that right.,2026-06-20 02:20:11
dcfd3b66-2b1a-4bb8-993e-27a9926f3783,Yohan Lopes,Google Play,1.0,0.0,"péssimo, parece até produto de vibe coding",2026-06-20 02:14:41
338b3ca7-1310-4b5d-99f4-2261cbb09f7a,Minhh Quânn,Google Play,1.0,1.0,"why do i have to hear other random song when i want to hear my playlist, i get it you want me to discover other song, but i have listened for 3 hours now and i can only listen to 3 songs in the playlist, at this point just delete the playlist feature from free option",2026-06-20 02:13:27
bafb47ba-c045-4728-9288-145d8f3fa181,Kirrily Quade,Google Play,1.0,0.0,why do you need to pay to listen to music youtub music is better the this -10000000000000000000 out of 5,2026-06-20 02:07:32
914f71e0-64f4-41ef-81d4-13b0fcd32f62,Alyssa Leblond,Google Play,5.0,0.0,"I love that I can listen to all my favorite songs, podcasts and even books. Makes traveling great and nice to have while on a picnic or the beach. I've had a lot of friends download the app as while.",2026-06-20 02:03:56
578e6eaa-8a0a-446e-a04b-3d52c1e5ec4c,oops sugarsorry,Google Play,5.0,0.0,"thank you very much for this service . I don't have the money level , and I recommend it to everyone . thanks still GREAT 👍",2026-06-20 01:55:16
9005264e-9951-4b73-b762-04c0801eefd6,Patrick Stewart,Google Play,1.0,1.0,"was very agaisnt Spotify for a long time, because I didn't like the idea of renting music that I already owned. But, I needed to free up space on my phone, so i finay gave in. I spent 20 minutes adding artists only to discover that I couldn't just have shuffle all- a feature that literally all music apps have had since they first existed. Why would I pay to spend hours adding songs one at a time to a Playlist, when I can open my phone's music apps and hit play, instead for free?",2026-06-20 01:51:38
eb23ffd3-e61a-4098-b160-492d1ce324e5,Ronnie Jackson,Google Play,5.0,0.0,"I love spotify, you can always find the best music.",2026-06-20 01:46:25
af7eeed0-6cc3-45e5-942e-1f2bdc44d56e,Supriya Biswas,Google Play,2.0,1.0,"As a free user, I find this app frustrating. I understand that premium users get extra features and that free users cannot download songs, which is fair. However, the constant ads and repeated premium pop-ups make the experience annoying. What bothers me most is that I cannot always listen to my favorite songs the way I want because of the restrictions. It feels like the app pushes subscriptions instead of giving free users a decent music experience. Music should be enjoyable, not frustrating.😤",2026-06-20 01:36:54
2a76b6fe-6ad5-4676-9ff3-ee8f443da70b,Lilith Ilvovska,Google Play,4.0,0.0,"good! I can listen to music and it really nice, though I did get annoyed bacause the app has some bugs that need to be fixed, bacause sometimes when I switch songs it just makes the song that I switch glitch badly, I don't know if it just me",2026-06-20 01:36:49
68d706a4-bb84-462f-80e3-f0f984ea8a46,Assassin Gamer,Google Play,5.0,0.0,very good for listening music and lyrics,2026-06-20 01:13:28
c2f37eb0-88e7-4d67-bc06-7f8fa54ab0ff,Latesh Sakhare,Google Play,1.0,0.0,Too many ads. Ruins mood.,2026-06-20 01:12:25
cbc8dae1-34b7-4a32-b2d8-27b04bb92e8b,Zeo Repko,Google Play,5.0,0.0,"Been using it since 2017 and have been paying for Premium since 2018; absolutely love the app and use it literally daily throughout the day. So many of the people I follow on social media have their own podcasts, which helps while I'm at work. Definitely recommend.",2026-06-20 01:12:08
e959d780-4dc4-4b1a-8dcc-34549f691fd3,Shaydeliz Santiago,Google Play,5.0,0.0,I love this app. it helps me with alot and I especially love listening to music while I do stuff so this helps alot,2026-06-20 01:09:19
07d8136e-afea-4581-a47b-1e93f9212176,Grassy,Google Play,4.0,1.0,"Pretty good for listening to music, especially since it plays when using different apps. Mostly. Sometimes you can play a game or whatever and the music will cut off randomly. Another thing is recently I'll open the app and it will be frozen on the loading screen. (I have to uninstall and reinstall every time)",2026-06-20 00:56:15
1ace7e6c-2022-4622-bd5e-fd73e1e25c95,Shabil Aiman,Google Play,5.0,0.0,The new listening hour of each song listing is very nicee,2026-06-20 00:46:08
13490388-e987-41a9-a540-267418d7de9b,JKWarrior Fitness,Google Play,2.0,0.0,I recently switched back to the free version. so many features have been removed. I can't even use Spotify offline anymore? like that was the whole reason initially switched over to it back in 2018. I guess it's time to find a more user friendly app,2026-06-20 00:37:55
489cf626-7b84-4ea0-a3e7-f96675b2553c,Nkosikhona Msomi,Google Play,2.0,1.0,"Maybe I do not understand the lay out but I'm having difficulty having New music like recently releases or new mixes. I have a PS5 so I moved from the other music app to join this app. When I did That I imported all my music to Spotify using another app. But all I hear or what is presented to me is my own music or mixes of the music that I came with. Please help. I need new music, like new albums and mixes from djs. I already had music when I came to this app, I wanna listen to more new musi",2026-06-20 00:05:50
936b50be-f84f-4ec1-9498-24364c36b523,Bhanu Karri,Google Play,4.0,0.0,this very nice app to listen anything song you like,2026-06-20 00:05:42
54f29972-2271-409f-9eb4-c22a58baaa5f,gaarabae,Google Play,2.0,0.0,"i am a spotify premium user. in the notification tab, it often shows shows i havent played or songs from days ago which i havent played. otherwise, spotify is garbage. the owner, the management, the ui, the algorithm.",2026-06-19 23:59:22
98350a55-a393-4c7a-bfb3-9ec1cf0533a9,Nathan Hickinbotham,Google Play,5.0,0.0,not long been using premium but it's the best thing I did my love for music has just been made more loveable due to this app love it five stars also my sister has used it for years and recommended it to me now that I can afford to use it,2026-06-19 23:53:30
2773ae33-8b4a-4120-99af-d39f0cef8590,Bradley Petty,Google Play,2.0,0.0,"Spotify is one of the greediest apps I have ever seen, you have ads every 4 songs and you'll get about 5 ads if you dont have premium, you can't organize your music listening either. The only redeeming quality of it is the selection of music it has.",2026-06-19 23:49:03
07391170-3330-4c0a-aea4-295f1130431f,blessing ada,Google Play,1.0,0.0,Tell me why after charging me a fee and I am still struggling to hear premium music without adds,2026-06-19 23:29:55
d5e01e4b-e7ca-4cb3-b463-6920cf5f1294,George Kavula,Google Play,5.0,0.0,"Great experience with this👌 I can find all my favorite songs, even from back then.",2026-06-19 23:29:00
a22568ba-09a3-4b24-94ef-535bdde234c6,CHINTAN PARMAR,Google Play,5.0,0.0,"it's made for me, it's like I am living for Spotify l, without it I can't imagine my life,cause I use to hear songs while gym, going to school,while doing hw and many times in a day too.",2026-06-19 23:28:40
39054f51-7ffa-4c09-bd20-1dfd4b5ec3dc,BEN LOWE,Google Play,2.0,5.0,"Is anyone else getting the same message ""Soundcore app is closing down"" & once connected it stops. I have just updated & it's now had a reversal of the update - a downgrade ! After the update I closed all my apps & am about to re-boot the phone... Will see what happens & report back - incidentally I am running a phone which I'm surprised any app is still running. 5* WILL BE RESTATED UPON FIX.",2026-06-19 23:22:25
6500b19b-894c-4495-9729-5e2cffaba335,Joshua Rodriguez,Google Play,5.0,0.0,we listen to Spotify every day.,2026-06-19 23:18:42
8602abd6-8770-47a3-8afe-1e1a5cff21c9,Shwetha Shwetu,Google Play,1.0,0.0,Spotify was one of the best apps but now if you don't have premium you have absolutely no control over the app you can't even choose the songs you want to listen you're forced to listen to their recommended playlist and you can't even skip more then six songs.,2026-06-19 23:15:25
8a29ff07-e30f-4f8e-8de2-f83df66533c9,da420wizzard,Google Play,4.0,0.0,love Spotify been trying to get my grandpa on it for a few years now my only complaint is sometimes I have to go and re-add songs to my liked playlist because of licensing issues.,2026-06-19 23:12:53
3317fc61-498f-4857-b7f3-4c1bae6731cc,La Pidd,Google Play,2.0,2.0,"11.99 a month and it has error messages when searching for songs. absolutely rubbish, and no live support. Imagine charging people for a subscription and offering no support. edit - their servers were down, as indicated on downdetector by thousands of users, but their response is simply to try reinstalling, instead of being honest and accepting that the fault was at their end.",2026-06-19 23:02:15
31dd29f8-0c47-4208-9163-945335997d23,pixie stix,Google Play,2.0,1.0,glitchy and expensive just to be able to listen to a particular tune :(,2026-06-19 22:59:08
64cb6b5b-761d-41d7-8e28-7b277baa2eff,Nikita Rai,Google Play,5.0,0.0,"love this app , and love u Spotify 🤩 please right now don't demand subscription to me , I am student. May be next year you can, Thank u .( I am saying this because u off my all play list song 😭 and my mood went off but after some time u will fix this suddenly I am surprised but thank u 💓 )??? Love this app again thank you 💛💛💛",2026-06-19 22:51:45
7d103fb8-2ad8-4556-b432-5e4a2d8fb053,Jack Moxham,Google Play,2.0,0.0,Slow and frustrating to use. Constantly re-downloading playlists which haven't changed since I downloaded them. UI is good...once it loads...,2026-06-19 22:49:14
9cdc6071-e71d-4e7c-810f-69cb48dd2cdd,Nina,Google Play,3.0,0.0,"easy to use, however the amount of ads between each song is ridiculous and the inability to turn off shuffle unless you buy spotify premium can be annoying if you want to listen to an album/playlist in order",2026-06-19 22:46:15
65ffd507-016f-4711-b8dd-84f6aa1b1d45,Joseph Porteo,Google Play,5.0,0.0,it's easy to find my favourite music,2026-06-19 22:42:05
bf7f8300-9fc7-4b96-8cfa-030969914175,VEERRAJU A,Google Play,1.0,0.0,"And worse, there are so many ads that it's annoying to listen to music. The ad song plays before starting the app. Song Song Ki Ad Music is annoying. 1/4 Ad. To listen to one song, you have to watch four ads. Worst app ever. It's best to download offline instead.",2026-06-19 22:31:22
8bed8aee-2541-4841-8fba-868e2303ae80,Puteri Sarah,Google Play,5.0,0.0,100 million songs at your fingertips. Auto-generated playlists based on my taste are spot on. Podcasts are great too. Sound quality is crystal clear.,2026-06-19 22:25:46
17f8b5d2-9946-4efd-bf12-e655a4c8666c,Dera Onwe,Google Play,3.0,0.0,"dude I use a Samsung s10 and nothing is wrong with my device. if I open spotify, it closes by itself after some sec while I'm playing music. I don't know what's wrong. I Uninstalled and then installed again, it still did the same thing. I'm rating 3 stars cause I know you guys will fix this problem. and please do it quickly. I pay for this service every month.",2026-06-19 22:14:47
a536357f-0412-4ec9-ac34-b232e4c38d11,Anand Maurya,Google Play,1.0,0.0,the worst app i have ever seen the ads and now I can't even play my own playlist properly what is the use of Spotify then,2026-06-19 22:12:55
0503bbb8-ab65-487a-b1f0-c268f318c9cc,Udit,Google Play,1.0,0.0,using monopoly to buy their premium..too much ads.. can't listen to search Music .gonna transfer to other platforms,2026-06-19 22:10:37
04476b24-b169-4bbc-8075-bb3d162aee6f,sara,Google Play,5.0,0.0,can hear variety of song from any country,2026-06-19 22:09:47
da29ec7f-5c18-4ce2-ae74-a2d47701aa9c,Vivienne “Junifox” Renard,Google Play,3.0,1.0,"love it when they add new features nobody asked for that makes it harder to actually listen to the songs I want, and said new features crash the app when I search for longer than 5 seconds for a song",2026-06-19 21:50:33
6c04fb21-7700-4a2e-b464-ab5a55b3eeed,Robert Hamilton,Google Play,1.0,11.0,A true invassive app. The auto connect/play feature needs to die. Just because my device is connected and or I turn the volume up on my stereo does not mean I want to listen to spotify. The shuffling of songs/artists when shuffle is turned off is unacceptable. Last but not least the repeat and recycling of the same songs and not hearing others out of my 2000 plus liked songs is also unacceptable. 260619 Been having the same problems with spotify. I just did the app update today at 1215est.,2026-06-19 21:45:54
120e70ce-77ab-40de-9da8-e0428dedbda0,DRACO,Google Play,1.0,0.0,such piece of smtg. This app is for listening music but I couldn't even change my music. To change my music i needed premium for it if I was former premium user. Very very bad app,2026-06-19 21:42:23
58dc833f-311c-4835-8a5f-24921636a93d,Jason Bennings,Google Play,1.0,0.0,"i listened to ONE ALBUM, it signs me out, and when i try to sign back in it's just an endless loading screen.",2026-06-19 21:39:09
64e38bd0-398a-444a-af17-34f1a0b0d6b8,Chandler Mclaughlin,Google Play,1.0,0.0,"Practically unusable without premium. Riddled with ads every song, and of course, they took away the only incentive to listen to the ads, which was the 30 mins of ad free music.",2026-06-19 21:29:21
aa9561b1-5d79-4b6f-b4a5-afee18f8472e,Arjun Khatik,Google Play,4.0,0.0,best app ever I tried for listening music,2026-06-19 21:28:43
0504270d-fe7a-41da-85d3-37590ee1af73,Mohd Arif,Google Play,1.0,0.0,"If you want to use this as a free user, don't go for it. It's complete trash—you can't even slide the music timeline or play your song of choice. Even the paid version isn't that great because there are still some limitations, so I wouldn't recommend it at all.""",2026-06-19 21:26:48
5af1c3e4-cb34-4750-9b11-9827f2c29d34,Glenn Powell,Google Play,5.0,0.0,This app has worked out very good for me and my wife since I got the duo deal. Way better than the radio or pandora by a long shot. UPDATE I have had Spotify for about 6 years now and I am still very happy with the results of great music choices wherever I go. Thanks,2026-06-19 21:22:48
e1437d01-495a-4456-9d7e-219de4eece4a,GamerBhrigu,Google Play,1.0,0.0,it is full of ads and locked features . we can't even play songs in order in playlist.,2026-06-19 21:10:19
4027f779-ea90-4a69-8373-28bd6f9da698,Andrei Bota,Google Play,1.0,0.0,I can't put my favorite music from my Playlist,2026-06-19 21:09:58
0c5c578c-3438-42d6-bd84-1fb5fb9846ef,Chalk Maze,Google Play,3.0,1.0,"I'm a long time Spotify premium user. Spotify used to be great for music and podcasts, efficient and easy to use. but no longer. Spotify is starting to get messy and commercial. It reminds me of how Myspace & Facebook used to be useful in their early days, but turned into bulky, spammy, corporate, garbage. I am looking for an alternative platform that isn't Apple, I recommend others do the same.",2026-06-19 21:03:25
eeb9cb46-4fea-41e5-b705-f10eae2d1536,devine parrilla,Google Play,5.0,0.0,"love it i can listen to podcasts, audiobooks as well as songs. I pay for the premium.",2026-06-19 20:51:33
bad19efb-b5e8-43d7-b3d0-52ac8019aa37,Ralph Marrero,Google Play,1.0,0.0,"Money hungry app!!! Definitely not worth it! you have to pay to choose songs? to have more than 5 skips per hour you have to buy premium??? do not download!!! I prefer alternatives like ""Musivibe"" or offline music apps!!!",2026-06-19 20:46:35
5acea42e-1ff2-4b8d-9f0c-88cb4f6342de,Chanmira Thamaljith,Google Play,5.0,0.0,I really like how I can listen any song with ease and yearly wraps i like them alot and the ui is easy to work with,2026-06-19 20:46:04
8b394dfe-7efe-41c9-8f5d-13840223dd17,Elizabeth C,Google Play,1.0,0.0,"After many years of using this app loyally, even as an Apple user, I decided a month ago that I was going to cancel it as I had been dwindling down my usage more and more, maybe using it for an hour a week so switched free version. I must say the amount of ads that you listen to is obscene. I get it. the world's lost the plot, people are greedy and they want more than they deserve. You can't even listen 2 your playlists song after song they shuffle the songs. Scandalous. I do NOT recommend.",2026-06-19 20:40:50
a7b90a6d-2c7d-4825-9385-a4074efeb655,Brent Sorenson,Google Play,3.0,0.0,"used for years but after the update now i dont have spotify ""currently playing"" on my lock screen and cant find out how to get it back. its in my notifications.",2026-06-19 20:35:17
2fa53f11-3949-47a0-89b0-5c5d3f353a9e,Edward Massey,Google Play,5.0,0.0,Nothing but good times listening to old tunes and the new.,2026-06-19 20:29:02
cd5aa09a-e88b-4148-8354-98486213af1b,Kizito Mulunda,Google Play,5.0,0.0,my favorite playlist 😁,2026-06-19 20:23:35
16d6c3c9-37e3-4a3c-ab4d-20e6021a8bf0,Praveen Singh,Google Play,1.0,0.0,"is too boring and The ads you keep playing again and again between songs, and then at the end, become really irritating and completely ruin the mood. Not everyone is going to pay for listening to music. Nowadays there are dozens of apps available for listening to songs. That's why I'll delete this app if the ads don't stop.""",2026-06-19 20:16:29
812db963-a300-429a-97e2-e4c310fe6b83,Aisha salihu Muhammad,Google Play,2.0,0.0,i used to love spotify both not anymore! how can i stream music with my data for 3 minutes and listen to advertisements for 10 minutes? it's cazy,2026-06-19 20:14:07
b4883279-36b0-4eea-9ec1-526a5b10721e,Soni Kushwaha,Google Play,4.0,0.0,nice app for listening music but after some songs every ad will force u to take premium that's why 4 star but overall experience is good,2026-06-19 20:08:05
5e767418-a5d6-46e3-bc52-400a6cff48c2,Gangesh Kumar,Google Play,1.0,0.0,"There is a limit on listening to the song and it is also a big issue in skipping when you play an ad after a song, please do not limit listening to the song.",2026-06-19 19:58:26
542cd031-9cdf-47d4-8c0c-67bcc3651c7c,Tim Smith,Google Play,3.0,2.0,"Been happily using Spotify Premium for many good years. I recently have had to contend with advertisements and banners popping up, which is fine with any other software or app, but when you specifically pay JUST to NOT have adverts it can be quite frustrating. Edit: The advertisements are inbetween podcasts and are independent of the host's own advertising, it shows up as ""Advertisement 1 of 1"" right after a podcast and is not part of that podcast. I have confirmed my plan is a paid plan.",2026-06-19 19:53:45
6dda3f3d-0423-45a3-9f04-fdb061746e7a,TeEe,Google Play,5.0,0.0,"fairly new user to Spotify, coming from YouTube music, so it's a bit different in format. So far, so good. I do have premium and I know that is better because you don't have Ads to deal with, therefore my review is based off having the better version. I never messed with Spotify without it. Something to keep in mind when reading this review. Could be loaded with Ads, I wouldn't know, is all. Honestly though, anything that has music involved is amazing to me. Happy listening, friends!!!",2026-06-19 19:53:05
4cc3a896-ca94-42b1-b17d-074dadbe8d64,Rilina Khatun,Google Play,5.0,0.0,"it,s a nice app for fresh your mood whenever I feel sad or low I listen music on spotify",2026-06-19 19:48:03
4c903aa4-45a3-408a-a42f-b8d911415e8b,Sudha Shreyash,Google Play,5.0,0.0,The best music listening app I ever seen♥️♥️♥️💗💗,2026-06-19 19:42:10
28387d2c-c67a-47b9-88cc-5a4d9f7428d7,aeroladd,Google Play,1.0,0.0,cash grab cant even play a song it just skips and plays some random song i dont even want to hear. get it sorted what a joke,2026-06-19 19:39:57
ced38db1-7720-401b-9871-574f7996e6af,Nandini Mandal,Google Play,5.0,0.0,This app help me to listen song in my free time . And this app save time .,2026-06-19 19:23:48
c12084bd-f4ee-4801-8d49-60916c02f1f5,Kosta,Google Play,1.0,1.0,"I do not recommend Spotify to anymore. There is ZERO customization on the subscribers end. They get rid of features that link you to your followed podcasts which now make it impossible to find new episodes. They constantly ""recommend"" garbage podcasts based on what you listen to, which isn't even close. It's more like the podcasters that they paid a bunch of money to who cant get the followers who they are shoving down your throat. ALL OF THIS FOR A HIGH PRICE, NOT WORTH IT.",2026-06-19 19:21:45
3e8b08d4-d3a1-4ff0-9c90-23092d909b39,Chisom Ukadire,Google Play,3.0,0.0,"the ads are much and frustrating, and they keep repeating ads too",2026-06-19 19:20:22
51953b01-4744-42bc-ad24-ec86407e4d50,LuigieatsBabies,Google Play,1.0,0.0,"I question why I'm paying for a service to listen to music offline, and the app hardly works offline. Making playlists shouldn't be a hassle, and the shuffle is garbage",2026-06-19 19:16:07
5413f434-207a-417c-869e-e1ddad2df38d,Stephen Makar,Google Play,1.0,0.0,now crashes when I try to search.,2026-06-19 19:14:43
97f90e2e-f338-45fa-8573-97747309c381,Humure samuel,Google Play,5.0,0.0,this app is better million times others I ever used since I started using it I started listening to high quality music than before.,2026-06-19 19:10:42
0d6c42f6-d338-4a6f-9adf-3370012e7f13,Harmeet Kaur,Google Play,1.0,0.0,do not play the same song which is searching,2026-06-19 18:54:28
3f7fbffe-421b-4efe-b735-829bb5e0f5c1,RIYA BISHT,Google Play,4.0,0.0,lovable romantic classy vibe,2026-06-19 18:43:22
63e21beb-fe82-4645-9b13-7221b08226de,Aaradhya Rawat,Google Play,1.0,0.0,"worst app, it's like i need Spotify premium to even play smth. I'm in a mobile and i can't loop songs unless i have premium, and as a student, I'm not permitted to buy any subscriptions. we know you need income, but genuinely stop. The amount of ads is just horrific, every two songs, it's a fricking ad. improve this Spotify, really.",2026-06-19 18:43:04
8310855f-d7d4-4455-b639-bf6c0d96ae4a,Parerna Rajput,Google Play,5.0,0.0,"so satisfying 😅 I must say that whenever I'm in bad mood, i open Spotify and listen to my favourite songs for healing..🤌🏻 Really, this app made my mood bad to happy 😺 sometimes sad songs and sometimes my mood generes... sometimes I want to listen some old songs and i doubt that can I find them on Spotify and really i find them and after listening to music 🎶 i just feel so happy and relaxed 😌 because sometimes music is just not about enjoying or listening 🎧, it is like a music therapy. 🩷",2026-06-19 18:42:52
66604434-ff77-4c40-bdc6-635e1e0c0181,Nic Barr,Google Play,3.0,0.0,"Spotify desperately needs a lyric update like apple music where the words follow along, and PLEASE update the add the Playlist button to not put songs directly into liked songs and just put the menu up so I can chose where it is added",2026-06-19 18:42:02
ef0345e3-4865-4502-bd55-a913fac41370,A Ismailov,Google Play,1.0,0.0,I really do NOT recommend this app.,2026-06-19 18:41:42
d17c8918-f50e-49ba-b94f-21b3e8945fd9,AAHIL BrawlStars,Google Play,2.0,0.0,"I love Spotify i Always use It for songs and everything there's everything but today I opened Spotify and I kept getting error I couldn't search anything so I log out and tried to log in back but it became even worse now I couldn't even log in Beacuse of this ""error"" now I can't listen to songs I lost my old account and literally hate this happening",2026-06-19 18:38:21
c307c1d3-873c-47f3-9ccb-b29066882e0e,Saima Amjad,Google Play,5.0,0.0,this app is really gud 👍🏻 . it's quality is also super gud and i would highly recommend this app for music listeners.,2026-06-19 18:29:07
c66de670-6013-4526-af4f-9fed69ac4042,Sarah Gosling,Google Play,1.0,2.0,"what has happened? plays music ok, but not podcasts?",2026-06-19 18:16:10
1ea096e7-ca31-4b23-b1c9-04c281485bcd,L.B. Tompkin,Google Play,3.0,0.0,"new update introduced a lot of bugs, searching for songs comstantly errors.",2026-06-19 18:14:29
