Review_ID,User_Name,Platform,Rating,Thumbs_Up_Count,Review_Text,Date
287c74ab-d918-45f6-8b88-67eb70dfcb03,Solid Water,Google Play,1.0,0.0,"Slow, too many ads, crashes all the time, and always stops whenever I turn my phone off. Stop wasting my battery and fix your background play issues, and maybe everything people have been complaining about if you bother to listen.",2026-06-20 19:56:39
4f38c9c2-5560-40d1-8dc2-09bbe3d65a18,Manyata Sadhu,Google Play,2.0,0.0,i cannot choose the songs i wanna listen without premium after 6 skips,2026-06-20 19:47:59
44c92663-9fa6-42fa-9eb6-32b78a7de8f0,Saksham Rai,Google Play,5.0,0.0,this app is very easy to use and navigate I love this app because of this features I can listen any music in this app,2026-06-20 19:42:11
28e75f5d-8e0b-4806-b4f5-5d7b963b2413,Yas Aghaei,Google Play,4.0,0.0,I liked it but I had so much ads and I couldn't find some songs,2026-06-20 19:19:59
7fc534bd-03dd-4e02-86af-293379431b46,Pratibha Chettri,Google Play,5.0,0.0,A fine app to listen to just TONS OF ADS FOR FREE ( MORE ADS AVAILABLE THAN SONGS ITSELF...BEST APP FOR AD LOVERS!!) 💗💗,2026-06-20 19:12:43
f8090215-482f-40d6-8897-7b49c5dd972f,Chiwelenje Silavwe,Google Play,5.0,0.0,best music and podcasts app ever,2026-06-20 19:05:14
6d4c022b-3e74-4819-9aeb-43ee9f41195b,Nishkarsh Dubey,Google Play,5.0,0.0,I love listening to music.... and Spotify is just great at delivering me what I want,2026-06-20 18:57:02
2fc84743-07fe-438e-bbff-39160cf82ee2,Risha Heart Rosales Limpin,Google Play,1.0,0.0,"The account I used for the premium subscription is the one i rarely use. What's with this app lately? Samsung kept saying it has bug when all I did was listen to tracks. The tracks currently playing keep on stopping, the application lags, it automatically shut, and takes times when I try to open it again.",2026-06-20 18:48:03
d6d0bbef-dd6c-41cd-b03c-6541aae242b3,Yathish Kumar,Google Play,2.0,0.0,it's giving the same playlist everytime and more ads day by day,2026-06-20 18:23:07
16c5fb7c-4d0f-4403-a717-5d5b87d5c863,Abba Bala,Google Play,5.0,0.0,Spotify allows you to experience the real world around you with podcasts music and more all in High definition sound,2026-06-20 18:22:27
e65b4eea-129a-48b1-84f0-61b328960b09,Alexandru Gheorghe,Google Play,2.0,1.0,"I only use it to listen to podcasts. have done so for years and have had a great experience. lately, with android 17, the app stopped working. get better engineers instead of AI bloat!",2026-06-20 17:36:12
845b890c-5755-48c4-b943-c03df1c25c9e,Smooth Cheese,Google Play,4.0,0.0,"Everything about this app is incredible. The music quality, the wide range of songs available. However the shuffle feature could use a bit of work as it may play one song then shuffle to a completely unrelated song in the next one. Other than that everything is great",2026-06-20 17:33:49
4b524021-c992-43ff-9f84-09acaf1d01e1,Ken R,Google Play,2.0,1.0,"i just want to listen to the playlist I created. stop injecting your music into my playlist. why bother building one at all. Edit- More forced garbage recommendations, ignoring my playlist. How utterly annoying. Lose another star. I'll check back in a few months. Fix this MORONIC setting or lose another star. After that, no more stars left = uninstalled.",2026-06-20 17:24:03
1bdcdc67-eb83-4dde-a2db-5cade53e98dd,Bernard Haywood,Google Play,5.0,0.0,"It is an excellent app I have used it everywhere in the car, in bed, and even whilst I was a presenter with community radio.",2026-06-20 17:17:13
d9fb22f4-75a6-47a8-9f57-32bbf27ac611,mahan a,Google Play,5.0,0.0,perfect app for play and search music 👌,2026-06-20 17:16:04
98216818-5b30-4d2a-9b35-e809ddc5be2f,Jashley Louren,Google Play,5.0,0.0,this app is so good. i can listen to it while in another app. knows my taste even. ill rate this about 89/70,2026-06-20 17:08:50
2875b793-6577-4476-9915-27a4bd723d8f,Angela Van der westhuizen,Google Play,5.0,0.0,love that I can listen to music while offline without listening to adds,2026-06-20 17:04:41
ed122653-441b-41e3-8d07-b719e7826943,JOEL,Google Play,5.0,1.0,"the best app as far as music is concerned -especially if you are using premium. the ""Smart Shuffle"" is very brilliant too",2026-06-20 16:58:02
aa23b82b-958e-4d8e-adbd-cb362de53f3c,Arianne Lecaroz,Google Play,5.0,0.0,spotify is a great app when you want to listen to music without listening to a dj and it has a wide range of songs to choose from,2026-06-20 16:44:06
c3b21da7-a9a4-4933-abd9-1ce87bcec08e,Jenny Escabar,Google Play,3.0,1.0,Love this app has all the songs I love and plus I get to like new songs to when it recommend music!! Definitely the best :3 ❤🧡💛💚💙💜 Edit: Okay so sadly this has changed my app keeps crashing like bad I've cleared the cache and restarted the app but nothing it's like broken. I love my music and during work I can't pull out my phone a fix it. hope this issue gets fixed.,2026-06-20 16:33:01
31a2d884-fe42-47d5-acc6-b792b4c43c1b,Hargun,Google Play,3.0,0.0,I didn't use the app for a week and all the songs from my playlists and other people's playlists just disappeared and I tried everything but nothing worked,2026-06-20 16:25:32
54347cae-759f-4043-89d2-735f6806a155,John Kanzlemar,Google Play,1.0,1.0,"Stop suggesting me podcasts in other feeds. If I'm already looking at a podcast I do not want to see episodes from other shows, let alone the ones that are being suggested. If I want to find other podcasts I'll look for them. If I accidentally click on one of them I keep seeing them and other unhelpful suggestions. Fix this or were canceling our premium subscription.",2026-06-20 16:19:38
46c1571c-4602-49a9-b098-d7a012c6fe37,Absar Haider,Google Play,1.0,1.0,"The number of ads on Spotify's free version is simply too excessive. Sometimes multiple ads play after every single track, which ruins the listening experience. I understand that Premium is optional, but free users should not feel forced to subscribe because of constant interruptions. Please consider providing a better balance between ads and user experience.",2026-06-20 16:19:31
b95d2b3b-e0b2-442d-9306-991eab9b2827,Shoshana Martinez,Google Play,4.0,1.0,Why do they want so much for premium when we only need to organize our queue?,2026-06-20 16:09:02
a45ec407-6106-4a37-a240-b6a888bfc228,Zuzanna Marciniak,Google Play,2.0,1.0,"I love Spotify, its a good app and I really recommend it but the amount of adverts are driving me INSANE.I can't even listen to 10 songs without ads interrupting me.you could at least add skip buttons for them so I don't have to waste 2 mins of my life waiting for it to finish.not only that but why are you adding random music to my playlist?I made a playlist on my Spotify for kpop but you keep adding songs like Ariana or Sabrina. horrible tactics,this is gonna take people away instead of helping",2026-06-20 16:05:45
a65816d6-06a3-4b2a-b63e-01e2345f1405,jignesh katpara,Google Play,2.0,0.0,"It's a great but after latest changes, you can't skip more than six times an hour and you can't play any song you want. like you search a song name and when it appears and when you tap on it, it says you should have premium and sometimes there are restrictions on playing your liked songs then what's the use of this app there are so much popups and all. you should improve for free users",2026-06-20 15:57:06
522a1d89-0ff0-4670-a909-98bb847d70ef,keerthana sureshkumar,Google Play,1.0,0.0,"Very disappointing. It is hard to enjoy music when I can't even play the song I select and basic features like repeat and replay are restricted. Randomly playing other songs instead of the one I chose makes the experience frustrating and inconvenient. It feels like these limitations exist mainly to push users toward Premium, which is unfair. I used to enjoy Spotify, but the free experience has become so restrictive that I'm considering switching to another music app.",2026-06-20 15:54:48
e46f68a7-3290-47ce-927e-c4ffd85404cb,Ben,Google Play,5.0,0.0,very good app I recommend!,2026-06-20 15:43:05
6abbe7ec-0a12-498a-b317-e3af4da66dac,VJ,Google Play,5.0,0.0,Been listening to Spotify for several years now. I've tried other apps... None of them compare to Spotify...,2026-06-20 15:37:17
c3405c3b-ce82-4bba-abf2-47cb68ff6927,bloo ket,Google Play,3.0,0.0,I like how you can make a Playlist but everything my Playlist ends it plays some random song why can't it just loop,2026-06-20 15:10:55
dc74c129-f3b5-4930-adf3-aaf1817bad81,Joshua,Google Play,5.0,0.0,"I enjoy utilizing Spotify for many different purposes. I will spend my time listening to podcasts while doing monotonous tasks. Music for my drives, and the ads are much shorter than a radio station. Finally I finish my day with calming ambient sleep music. It's a great App!",2026-06-20 15:07:25
d093bd08-49b1-46df-b518-993888e24c21,【DR】 Rajdip,Google Play,1.0,0.0,not worth the premium subscription in shuffle suggested song from Spotify is always same repeat again and again every time you had to search the song bakvas 😺,2026-06-20 15:02:38
bc713d61-6a35-4b63-afe7-e7ce438c042e,Anna Mariya,Google Play,5.0,0.0,I like this app so much. I recommend this app for every music lovers,2026-06-20 14:47:36
35f926c0-cb64-45db-86fc-5287b951ded9,Sharifah Alsagoff,Google Play,5.0,0.0,Regular updates and improvements show that the developers truly care about the user experience. Highly recommended,2026-06-20 14:45:04
2e95742a-2500-45c3-b4c7-54d0a70c5af5,Katia,Google Play,1.0,0.0,"The amount of ads is ridiculous They pop up after every single song, up to 4 in the row, repetitive and uninformative as well. Artists do not show up when I'm searching for them, the shuffle never did its job, the same bunch of songs play everytime and you can't really change it. Developers became too money greedy, giving up user experience with every new update.",2026-06-20 14:20:05
486e7d0d-34b2-4ca8-9122-4c7495614063,Aisha jabbin,Google Play,1.0,0.0,worst app ever I cant even play a song which I like this app only plays recommended songs and i can only skip 6 songs to skip more songs a have to pay them for premium what kind of non sense is thiss,2026-06-20 14:14:36
1f396e9b-39be-4106-bfec-ca2c70e5bf81,Aps Shop,Google Play,5.0,0.0,it has a lot of song to choose and listen,2026-06-20 14:13:16
f1ee551f-f54c-4f29-b7e8-4e37814e4c2a,Rehan Khan,Google Play,4.0,0.0,little bit adds while listening songs please set this add problem,2026-06-20 13:52:06
cf6d4efc-fadd-42c6-9e47-5e2cd5ea3b6f,Apoorva Bhatt,Google Play,5.0,0.0,"I don't know where i would put this request, If possible give the title of the songs and the artist's name in Romanized form, for many Japanese songs for e.g. for Monogatari Series it is not in Romanized form, making it harder to search in English. Secondly Please please add more JHip-Hop, and JPop and more International music, especially the songs/music of Yoko Kanno, Tsutchies, Nujabes. Thirdly Public playlist of users and official (O.S.T.) playlist should have different tabs.",2026-06-20 13:47:04
f6e4d9fd-b2be-4211-bf1d-5305b9597180,anton shepotenko,Google Play,1.0,0.0,"spam banners for the whole screen, spam pushes, useless support, keep recommending to reinstall is all they can. also main page is just a mess comparing to previous structured ones",2026-06-20 13:39:16
9f659f43-b687-423b-9301-283b6618a422,S.N.Arul Jothi,Google Play,5.0,0.0,Excellent App to change the mood.,2026-06-20 13:33:40
451c7dd7-acff-4cde-ae50-8358b226fa6f,Dibyansu,Google Play,1.0,0.0,"I'm gonna be completely honest. The update is absolute GARBAGE. I can't play any specific part of the song. or change my desired song on the Free Version, there's literally no point in listening to music then. I can't even play specific songs from my playlist, and constant ads and pop-ups for Spotify Premium are really pissing me off. I mean, you're snatching out literal bare-minimum from the users to pay 400INR or something? I'll switch to other apps, at least it's not “pay to use” like this.",2026-06-20 13:30:14
acda0e59-2332-4a75-968b-1be27311bc26,ash,Google Play,4.0,0.0,ads ruin my vibe💔,2026-06-20 13:28:23
f54890fb-cb02-4580-8c39-dc7e0e57052a,Oratile Moretsi,Google Play,4.0,0.0,"The app works perfectly fine, but my problem comes when I can not listen to music offline",2026-06-20 13:26:17
25b5a5eb-ba6a-49f3-8dab-636888db9c4f,Yippee,Google Play,4.0,0.0,"the bug ui doesn't fix, it's combined same ui.",2026-06-20 13:20:37
2e627880-d96a-45c3-9afa-a74516332eee,Riddhima Srivastava,Google Play,2.0,0.0,"Everything about song quality is great but the ads literally pop up after 2-3 songs and its irritating tbh, why do you expect money for everything? does streaming the song on this platform not pay your bills? or you just need extra!? a few options being available for premiums is okay but like I can't change a song after 6 changes for 1 hour!? wth? I can't also get to a particular verse i want to listen!? this is way too much interruption! you need to stop taking advantage in the name of premium!",2026-06-20 13:19:05
96483821-447d-478a-9a81-db34b7a0da19,Karabi Borah,Google Play,1.0,0.0,"Spotify is the worst nowadays...Initially it was okay....I want to pay for download, offline backup, queue, peek at the upcoming song, and good quality listening...But now; it has been getting even worse...I want to pay to listen to a part of a song midway ,also I can't switch to another song while I am listening to a specific song.....I am requesting Spotify please don't do it with us....Is a poor person cannot take the pleasure of listening? Also you have no any legal rights of these shi**s...",2026-06-20 13:07:26
2312a09b-9c09-4b0f-8845-05c7c8114b60,Keshav sharma,Google Play,5.0,0.0,this is the best app 🤧❤ I cry after listen Arz Kiya Hai 💗,2026-06-20 13:04:52
a20af0a3-ce73-4f67-858b-740fb263c3c9,Utkarsh Singh Tomar,Google Play,4.0,0.0,"Excellent app, would love to see custom themes! The music discovery algorithms are on top-tier. I constantly find new artists, songs and podcasts I love, and the cross-device switching is seamless. As a feature suggestion, it would be amazing if the app introduced a customizable themes option where users can choose different color themes. Adding a personalized visual touch would make listening to music on the platform feel even more interactive and engaging!",2026-06-20 12:59:20
bf0ca709-37ae-4683-9547-75c9a1152fc2,prajjwal pal,Google Play,1.0,0.0,"He listens to less songs and adds keep coming, very bad application",2026-06-20 12:49:38
7229e567-c692-4736-a9aa-0e7f96dc6598,Syifa Damiah,Google Play,5.0,0.0,I very love it when I hear a Billie Eilish song,2026-06-20 12:39:39
98e9698c-504d-4c2c-9bc6-c173daa60ba9,Hoxh,Google Play,3.0,0.0,it's good to listen all my fav songs and listen while playing Roblox but one thing I don't like adds without ad it's 10/10 good,2026-06-20 12:36:46
404653a9-54aa-4899-853d-0311d9fd2bdc,tw33dle_,Google Play,1.0,0.0,$12.99 for an app that crashes every time I try to search for a song.,2026-06-20 12:23:29
8ede350b-5692-44f7-8f4e-9d3dd20a04c2,Ria Kim Reyes,Google Play,5.0,0.0,"a great use for a student like me who loves listening while studying or even on our vacant, been using this for 2yrs alr so I think its finally THAT time to give this a good review since I'm benefiting on it not just on listening but mentally–this is all I had when no one's there for me. Living in Baguio without anyone to be with is so depressing–luckily Spotify's there to accompany me all throughout my emotions weither I'm sad, happy or even gloomed. I'm happy to use this app🤍",2026-06-20 11:48:35
ef088d6d-a445-4051-b9ee-ad8f4a5320e6,Kalpana Chauhan,Google Play,5.0,0.0,"""Best music streaming app! Easy to use, great playlists, and a fantastic listening experience."" 🎧🎧",2026-06-20 11:43:33
103a3239-41f4-4dc0-aaf1-085b8b0f8ac0,Sanjaya Kumar Nayak,Google Play,5.0,0.0,it is a bast option listen to music .,2026-06-20 11:21:30
0f503d0d-c3d4-46c0-bb06-fd7aef49dfa9,vishakha gupta,Google Play,1.0,1.0,"Before it used to be really nice but and no ads required premium which was understandable but with new updates you can't even put on your song u want to listen and can't even put your favourite part in the song without premium, it's like sacrificing quality just for profit. VERY DISSATISFIED",2026-06-20 11:13:15
a8ad015c-25ba-4697-8fb4-a774a08d235d,Oups,Google Play,1.0,1.0,its not like a few years back. No matter what i did : clear the smart queue.. desactivated the auto add songs into the queue.. spotify forced me to listen to song i hated and didn't choosed. It slip songs into my playlist witout my accord.. Can't really play with my phone while driving to select the song from my playlist i want to listen... thats what a playlist is for... yes? .. had premium.. 2 more free months... no thx.. I rather try YouTube music for about the same price.. 11-12$/month.,2026-06-20 10:43:26
cff93292-ae76-49f9-b403-9e25072edc52,Jon,Google Play,5.0,0.0,I've been using Spotify for several years. Multiple playlists of my own have been enhanced lately by the featured releases and playlists from Spotify. Love it!,2026-06-20 10:30:59
5ad745b0-4040-484c-87aa-8dba170bf0d2,James Rutherford,Google Play,1.0,0.0,"Redownloaded this app for the first time in years just to use the mix option in playlist settings, only to find out that this feature that's been out for nearly a year is being slowly rolled out at random. Save your money and don't bother.",2026-06-20 09:44:39
05c045d4-be5b-4f00-8fc8-c4d04537ce2b,Kathleen,Google Play,1.0,0.0,"the app is great, it's good to have a app that gives musics. but it's terrible due to the ads. the ads are so long, and this app is obsessed of trying to make people get premium! it's a shame to see a useful app get crowded with advertising. I have to wait 20+ seconds for TWO ads. so long, even trying to skip other musics when skipping is even a 'vip' stuff to do. even people in social media is pissed off about it. do Spotify even listen to their complaints?! every app now has a subscription..",2026-06-20 09:25:39
33f3edaf-dbf1-481d-8354-16aff1ade326,Kyran Perfect,Google Play,1.0,0.0,"barely works on chromebook, either the ads get stuck so it doesnt end and you cant listen to your music or the app just loads up but has a black screen and does not load anything",2026-06-20 08:52:41
ada03b12-db4e-4aff-8fb3-175b17209c6c,Kimberly Lei GG as,Google Play,5.0,0.0,I love how I'm listening to a song and it automatically plays songs from that genre,2026-06-20 08:47:56
46fafc2d-b64c-45b5-bd34-4b0307528ef9,Cheech Cheech,Google Play,5.0,0.0,I love this app I can go play other games while still listening to music,2026-06-20 08:47:22
9fc4cc5a-16cf-447f-ba74-e551261c0774,Gabriella Harrison (Gaby),Google Play,5.0,0.0,it is amazing. i love to listen to music and this app has given me the best experience and gives me best options to listen to.,2026-06-20 08:37:21
e9012e50-ca84-4860-875f-5430a5ec8e30,Vivaan Bothra,Google Play,5.0,0.0,we can listen to any music in Spotify at any time.,2026-06-20 08:36:27
85ee282b-41b9-4941-9d6f-60d41b633b3b,D Gilreath,Google Play,3.0,0.0,Need help please - says have bug. I've scanned & found nothing. paying member & haven't been able to listen for weeks...,2026-06-20 08:26:20
e4913559-459e-4e81-a660-a5c483f0a352,Netravati Marennavar,Google Play,1.0,0.0,unable to open this app on phone do something unable to listen to the music,2026-06-20 08:22:53
2bb3d022-5631-4945-ab17-62011fbadaae,Bennyrista GM,Google Play,5.0,0.0,"I honestly can't remember life before Spotify. The algorithm is downright spooky with how well it nails my taste. every weekly discovery playlist feels like it was hand curated by a close friend. The app is incredibly smooth, switching from my morning run playlist on my phone to my desktop at work without missing a single beat. Offline downloads have saved me on countless flights, and the sheer volume of podcasts keeps me hooked. Worth every single penny of Premium.",2026-06-20 08:02:01
ff588b79-6728-433c-86b4-9e84826d3bf1,izzul sado,Google Play,5.0,0.0,"Spotify offers an outstanding music streaming experience with an extensive library of songs, podcasts, and playlists. The personalized recommendations are highly accurate, making it easy to discover new content.",2026-06-20 07:37:50
69578ba4-db8d-403d-9225-4eee71dce126,Gloria Taylor,Google Play,2.0,1.0,"I could only listen to two or three songs before I get 3-5 ads. I would also constantly get the same ads over and over again, even when I do ""I get this ad constantly"" when it asks. Honestly, there should only be one to two ads after about three songs, and not 4-5 ads instead. I would also get different amounts of ads after listening to a few songs. But either way, the music works well. As a mobile user, I didn't see a clear queue button when I tried to clear my queue, please fix all these.",2026-06-20 07:23:13
a4d76c75-c432-43a0-bcdd-9397832d180f,Vivalvvv_05 Val,Google Play,5.0,0.0,"I really really enjoy this music application, cause I can find all the songs that i want, and i have subscribe to their premium, and i enjoy it very much.",2026-06-20 07:15:17
261d9e3c-c38c-484f-ada2-47227cbe6e3d,Cassandra Cee,Google Play,5.0,0.0,love Spotify best app to feel your mood,2026-06-20 07:05:19
e7763c61-4608-4249-8dbc-6c37ba7efd0f,Trina Jackson,Google Play,3.0,0.0,"I dont like how it doesn't show the songs in my Library but instead recommendations for adding a new song to it,like if I want to add new songs to my Library I will",2026-06-20 06:59:01
f651dfd4-1099-49bd-96a1-1ec58b77e3c9,Rainy night,Google Play,5.0,0.0,very good apps to listening music. have so many song that available from every country,2026-06-20 06:54:55
b8f6821f-5160-4cf9-b2d0-cf71cfcd82ac,Kunakorn Thepwong,Google Play,1.0,1.0,"can't listen to the songs from my playlist, after 1 song it shuffles to a completely unrelated and off-genre song that I have never heard nor want to hear.",2026-06-20 06:47:23
d0bb42cc-8753-4f1b-b5de-1e340aad3420,jetlee pelitones,Google Play,2.0,0.0,"I would rate this 2/5, the song quality is good and really nice too, but the fact that ads interrupt songs was a no for me, but if the ads were more less and no Interrupting, Id give this a 4/5 :) I would recommend some more updates about the ads, since it breaks peoples peace, although I can't tell what to change, Id really love for it to stop interrupting ❤",2026-06-20 06:46:25
f627fd6f-5dc2-4e34-9270-0bb4d122ef2d,Kaushal Kishor,Google Play,2.0,0.0,I am giving that 2 star rating because when I am trying to listening the song it shows that you want buy premium membership i don't want to buy the membership of it because I am just listening the song for getting relax . and on this it shows me membership,2026-06-20 06:42:49
79f21680-acf6-421e-a2be-99997922adac,Greg234,Google Play,1.0,0.0,money hungry app forces you to get premium just so you can turn off smart shuffle and actually play the songs you have in your playlist in order instead of playing songs that arent in your playlist,2026-06-20 06:41:57
fee9fa9b-c32b-491a-8343-19dd95031f45,Jatin,Google Play,5.0,0.0,I love listen songs while sleeping travelling and walking and its the best app for me,2026-06-20 06:41:08
98be8714-40e4-4f1f-8912-a261d92f14c7,Leah,Google Play,4.0,0.0,"I absolutely love Spotify, you can listen to music and watch videos but I feel like there are lots of of ads, like after every song I have a two minute ad. but otherwise it's the best thing ever and my most used app. ❤️❤️❤️",2026-06-20 06:39:44
f9769842-f516-4b80-921c-cb94eaab0dce,Tara,Google Play,5.0,0.0,I love this app it is soooooooo amazing you can find any song you want!,2026-06-20 06:38:21
97a72d84-94c5-4859-b2bb-55365c738acc,Caleb Franklin,Google Play,1.0,1.0,"I already had an account on my old phone so I clicked ""log in"" and when I put my Google account it said ""this account is already logged in would you like to go to log in"" and when I clicked yes I did the same thing repeatedly.",2026-06-20 06:18:10
98dd52f0-e279-4592-a542-68e5fd6a4f31,Erik Andorfer,Google Play,1.0,0.0,no actual shuffle,2026-06-20 06:15:34
fc94dbcd-8012-4685-8847-39dc6859ce85,Mrs Peal,Google Play,5.0,0.0,it is good bc you can play a game and listen to music and play other songs 🎵 😃 ty for making this app.,2026-06-20 06:04:51
6496c91a-57ae-4c15-89b4-dbd1d1300453,James Sass,Google Play,5.0,0.0,plays a great mix of all the 80s hair bands I grew up with. I love it.,2026-06-20 05:51:15
df10672b-89e8-4461-bf3e-aba1aef7bbc7,A. Brown,Google Play,1.0,309.0,"At this point can someone recommend a different streaming app besides Amazon music and Spotify. Every time this app does an update it goes black and won't load for days. I'm sick of it. I use to love this app. Now it acts like it doesn't want to work. It will swirl like it's connecting for long periods of time, it no longer let's me like songs, and it will just stop mid song. Please fix the issues with the app. I tried to to a feedback report and the app just shuts down. Very disappointing 😞",2026-06-20 05:28:59
94ac239f-b37d-4f42-82e5-d29c078ae219,Jocelyn Alcocer,Google Play,2.0,0.0,"Minor issues with the app. Recently with saying I have no service in areas I do, as well as looping every playlist I listen to automatically. It's very annoying with no solution to it in the settings.",2026-06-20 05:04:10
fc398d1a-e0e7-4525-bfc0-5e3f86ad89d7,Chris Suzor,Google Play,4.0,0.0,"Ya know... the one thing I'm thinking about when I'm on Spotify is this, why is it so hard to find my people. Why is it so hard to find them and then why is it that they're always the best kind of people... the people with the pure hearts and the ones who genuinely make us feel like we're walking on cloud-9... the type of person who actively listens to you and loves you for you, not the other ten billion screws you have loose...",2026-06-20 04:49:29
