Review_ID,User_Name,Platform,Rating,Thumbs_Up_Count,Review_Text,Date
d9c469c5-36e6-49ce-83d6-1777895df468,blackrose lemonsweet,Google Play,1.0,0.0,"it keeps glitching and saying theres something wrong every time i search a song , its been doing that on and off for like months i thought I fixed it but no it keeps happening and i know theres nothing wrong with my internet connection so idk what's going on with this app",2026-06-19 18:10:49
7e9edf86-f31c-4d64-9bab-5a870dc27543,Tammy Hagin (TastyTraveler),Google Play,5.0,0.0,"I've only had the free 90-day trial of Premium and I love it!! Create my own play lists, then when it completes playing it, it plays music that meets the music I have saved to keep playing. No ads is the best!! My only recommendation is to have a sleep timer. I've had Sirius XM for years and like playing softer music as I fall asleep but can't locate a sleep timer on Spotify.",2026-06-19 18:09:20
69ce62d3-f6cf-4835-b8d7-96aeaa79365a,Harry,Google Play,2.0,0.0,the apps pretty good but without premium you can't do nearly anything except press play and listen to what you've been given 😔,2026-06-19 18:03:36
23306eab-690c-4c1a-b9fd-9505bc9e2b02,Dave Wolken,Google Play,1.0,0.0,"Multiple functions don't work, including search. There's just a ""Something went wrong. Try again?"" message in various parts of the app. And no Help/Support option easily found in the app. My app is updated. I have cleared cache and restarted.",2026-06-19 17:55:29
51f6ae46-7533-4f4c-a4c4-0ac4d2293dc9,Matthew,Google Play,1.0,0.0,they should just make it where you have to pay for it you get like 4 or 5 adds most the time after every 3 songs and when you get your 30 minute add free you have to listen to the same play list or it won't work also very glitchy I have perfect internet and it wouldn't let me look up a song or look at a lot of stuff just a very dumb app id rather listen to music on YouTube at least I can skip the add most the time,2026-06-19 17:51:32
3311ecdb-57aa-4f6a-9a1a-0cf9b9f71f5a,Aashritha Sreeja K,Google Play,5.0,0.0,"when I want to hear music, the only one thing that satisfies it is Spotify. it's more like Spotify is music and music is spotify",2026-06-19 17:35:59
9378ab65-7244-4522-8330-7f519409be3d,Wisdom Wosu,Google Play,5.0,0.0,Amazing music app with non stop vibes... love it,2026-06-19 17:35:03
9725eaf3-0152-4089-b7a6-195ebe62d0d2,Eimantas Noreika,Google Play,3.0,0.0,"all of mainstream songs are there, which is amazing atleast for me. The only flaw is that you have to listen to 5 add's per 2 songs and cant choose what songs you want to listen to.",2026-06-19 17:09:46
47db94c8-d5c6-444a-9170-b216bd5fbfe4,Chris Jo,Google Play,5.0,0.0,"The cruise control based on my liked songs is mad!!! It brings similar songs, beats and vibes. I can relax after my liked songs are exhausted knowing you've got my back",2026-06-19 16:59:50
cc1994bc-887e-4316-8f0b-98735531fc5c,Luvo Ntshangase,Google Play,5.0,0.0,I'm enjoying this app because I find it easier to use and I can find all my favourite artists here.,2026-06-19 16:56:03
b51692bd-e268-46ff-9667-ee9ed42796fa,Farida Assem,Google Play,5.0,0.0,It's so so so good but it's too vip man like leave me alone and I just wanna listen to music in peace,2026-06-19 15:58:12
6d98d155-80d8-46f2-805a-54e93be4e582,Tyler Briggs,Google Play,5.0,0.0,"Spotify has quite recently added the ability to (un)filter playlists and radios so they aren't customized. I cannot express how important this is to me, personally, as this is a really fantastic way to discover and enjoy more music.",2026-06-19 15:57:45
dbaf563b-7117-43bc-b310-bfea5c77407e,Riddhi Varshney,Google Play,3.0,0.0,too much ads ik premium is good but without it a lot of ads come after every 2 min song a five minutes couple of ads is needed to be listened 😕😕,2026-06-19 15:19:25
080d8355-476e-4419-94ed-f18210ec9906,Dai Williams,Google Play,1.0,0.0,"If I am listening to a podcast series and I am on episode 38, when that finishes I want to listen to episode 39. Why do you play the most recent one? Or sometimes a totally different and unrelated podcast series? Why is it impossible to find things easily on Android Auto?",2026-06-19 15:19:25
a8112429-e2a2-4681-8fc0-14018680a0da,Raz The Mentor,Google Play,5.0,1.0,"I really love this app.. I love to hear songs while studying and this app helps me in the best way!! Spotify helps me to discover new songs. This has been the best part of my music journey! The 'Discover Weekly' and 'Daily Mixes' are pure magic. I’ve found more new favorite artists here than anywhere else.""""Spotify doesn't just play songs; it curates the perfect moments of your day.""""The recommendation engine is simply unmatched. It knows exactly what I love to play👍💕💖🤞",2026-06-19 15:01:00
ba8b03b5-865e-43b0-8fe4-3c4f83f45f6c,Patrick Lynn,Google Play,5.0,0.0,great real pogcast I have listened to in a long while,2026-06-19 14:28:24
141c298d-5f44-468e-939f-725fed713fa4,Harry Lowe,Google Play,4.0,0.0,you guys need to here this everything is great about the music and podcasts and many other things BUT. some things I think need to be fixed. including the ability to report things and be able to remove things from your profile. other than that this app is one of the best of any apps and is awesome!!!,2026-06-19 13:57:49
33423c63-832b-4183-9f66-a0b53b815331,Saint Peter,Google Play,5.0,63.0,"Best music app for uncomplicated listening! The elapsed time between installation and sitting back to relaxed listening is about as short as it could be. I've had it installed for over a year now and so far it has found every album, song, artist, and genre I've searched for ......including the yodeling song by Frigid Pink! 9.5 thumbs up! Update June 19th, 2026: And after being a subscriber for many years now I can honestly say that it is the most used app that I have installed on my phone...",2026-06-19 13:57:28
746b069d-0e74-4548-a2d2-e1e144364537,Bonaventure Kimario,Google Play,5.0,0.0,i can find allmost all song that i need with lyrics.. i love it,2026-06-19 13:46:47
00b712e6-dda7-4baf-8c17-e4c60bc351ce,Neelam Arya,Google Play,1.0,0.0,if we can't even choose a single song that we want to listen...then we can't even call it a music app...waste of my phone storage...some lowlife greedy app.,2026-06-19 13:24:01
91fa7061-cfe0-4f66-b8d7-98e6b0142f01,Rob,Google Play,1.0,0.0,"Devs don't understand that 10x more people (including me) would subscribe monthly for 2.99. Instead they only get 1/10th the subscribers at $12.99 and lose about 60% of what they otherwise could be making. Devs also don't understand that force shuffle AND ads are too much. It drives people off the app so they get less ad revenue. If they change subscription cost to 2.99 their sub revenue doubles. If they allow no shuffle, then ad revenue also goes up substantially.",2026-06-19 13:12:06
b9dde8ef-8b2b-4e17-bc34-fcb1c6227b6b,Baliram Korde,Google Play,1.0,0.0,The app is full of ads only. The worst app to listen to songs💔🤬,2026-06-19 12:59:08
28f30932-cd88-44f7-b1e0-7005a02d8dd4,Sujit Kumar,Google Play,5.0,0.0,very amazing app for listening song,2026-06-19 12:48:41
4c3098e9-d98e-481b-99bd-b781513159e4,Lilia Rezgui Pierre,Google Play,1.0,0.0,Too much adds ! impossible to listen to more than 3 songs without having ads (often in threes) playing. Spotify isn't what it used to be,2026-06-19 12:39:31
831e3db6-528b-42c0-9419-441e106515fe,Richi Benjamin,Google Play,4.0,0.0,"After the latest update,MUSIC FOR YOU option is not available and the music recommendation are not matching my GENRE,Had a chat with SPOTIFY agent but not much help.Please fix this issue at the earliest...",2026-06-19 12:37:12
5fdd5722-c384-42d5-9d68-88d129fe1010,Faith Mutsambiwa,Google Play,5.0,0.0,I love how simple and useful this app is - highly recommended!,2026-06-19 12:15:40
0830dfc0-af19-45ea-b122-6ac8b0ddb4ad,Justin Tharp,Google Play,5.0,0.0,I couldn't live without music & Spotify makes it so simple + finds music u will like after learning what u like! A+,2026-06-19 11:24:19
cd1174a1-edb0-4499-9ffc-64015d6e7621,josephine hernale,Google Play,5.0,0.0,nice when it comes listening music,2026-06-19 11:11:31
3008baae-c41e-40c3-8bbc-27a506b442b0,Liyabona Bradley Tshikini,Google Play,5.0,0.0,"Spotify is perfect when using premium, but I would still give you 4 stars without premium cause I get to listen to music for free if I want to and a broader song choices to choose from.",2026-06-19 11:08:12
3ce0edea-3953-4b53-a9e7-88618a5044a2,Krishna Kesarwani,Google Play,1.0,0.0,Can't even listen to songs you like anymore more than once a day just because you don't have premium,2026-06-19 10:31:05
ae09c47a-4612-4f65-821c-f46efcc02003,Roberto Naherajr,Google Play,5.0,0.0,I really recommend this app to anyone I like the way a work and make me happy to have Spotify thanks and give a good use please 🙏,2026-06-19 10:22:37
d73bccc3-1976-4502-bfc6-59e10809c4d0,Esau Ramirez,Google Play,1.0,0.0,ur new update on consoles like ps5 broke the spotify because i will play manually play the last song i have on my list and it will do the one before that idk if its the fact that the ps5 and phone updates are different because they are linked to the same account.,2026-06-19 10:09:38
9393ed71-bd99-4d53-93e6-1df52cab3160,Sophia Hamrah,Google Play,2.0,0.0,"I could you not, I get 2 minutes off of music cuz the ads. Theres like 4 ads every 2 songs. Like why would i watch ads when i could just listen to music and give this a proper 5 star rating?",2026-06-19 09:58:06
fc3df93a-cbad-4a7a-8b90-ee9f3d5b6325,Pratima Namdeo,Google Play,1.0,0.0,so bad or worst after few days it asks for premium and you can not play song of your choice even if you make playlist😠😡🤬you would face several long ads even in a 2min song,2026-06-19 09:46:04
d7cfc859-fcb3-41ce-90c9-b2c4d7576f02,Guy Goza,Google Play,5.0,0.0,I'm ready to vibes and nice music 🎵 thanks,2026-06-19 09:30:54
600a13dc-213b-44cb-9f1d-03ef1c2f8608,ucingpeot23 Ucingpeot23,Google Play,5.0,0.0,if I listening Spotify music I so relaxed,2026-06-19 09:09:19
9b70c75b-9a45-4416-affb-b3e64dd40d55,Danger Stout,Google Play,1.0,0.0,Wants me to get premium for everything I was listening to music and I chose a song and it said to buy premium for listen to any song anywhere remove this feature it's just gonna make more people uninstall the app,2026-06-19 08:38:55
31dda810-797d-4731-a5ec-9ea229c29046,Ricardo Jonathan Moreno Gomez,Google Play,1.0,0.0,"BRING BACK THE OLD WIDGET RAAAAAH! THE NEW ONE F SUCKS. The previous widget won me over with its simplicity. The new version adds features, but in practice it's clunky and less useful. My listening time fell from 1,300 to 600 minutes because I end up bypassing the widget entirely and going straight to the app. The biggest annoyance? The old widget constantly nags me to switch to the new one",2026-06-19 08:30:10
a2b0e82c-247e-4ea5-8e95-2a00310fd49c,Selvi Zahir,Google Play,1.0,0.0,"so bad, to listen to a music we need to watch full 2 ads first, its super annoying. I was there to listen to music and not wasting my time on the ads, pls fix your ads problem, spoitify.",2026-06-19 08:30:07
77d3ca2d-be09-49c3-b3e2-a8c0cecdca5f,Jamal Hurley,Google Play,5.0,0.0,Love this app. So many great songs and Playlists. I love the fact that you can create your own personal radio stations based on the genre of music that you like 👍,2026-06-19 07:59:48
c4d9e1ea-78f5-40da-bf51-eef12f23ccd6,Arianna Donaldson,Google Play,2.0,1.0,the free version is horrible I am unable to pay for premium features and I have to deal with the free version you only get 6 skips an hour you can't change the queue you can't go back to a previous song! ...at least give us the ability to change the queue + go back to the song that just played at least the ads are bearable for the most part tho edit: WHAT THE HELL I FOUND OUT THAT YOU CAN'T EVEN CHANGE THE ORDER OF THINGS YOU PUT IN THE QUEUE AT LEAST LET US CHANGE THE ORDER OF WHAT WE PUT IN 🙏,2026-06-19 07:57:58
f1cdc8c3-40e5-4b60-8781-497aeb477d8f,Sugan G,Google Play,1.0,0.0,"Spotify has increased their prices too much. Request to bring back the price. I had switched to apple music. it provides affordable listening experience. with lossless music. but the suggestions in Spotify is good that i feel like coming back, if the cost is affordable",2026-06-19 07:52:45
ab7a1249-8d6c-4d83-9f97-32ba1fa5e295,Jack Hill (Just Jack),Google Play,2.0,1.0,"Basically everything it seems in the app at some point is blocked behind a paywall or just blocked in total like shuffle options and stuff like that, and 6 skips an hour? thats just bs. Prolly one of the only negative reviews and please FIX THE XBOX VERSION ITS SO BROKEN I DONT UNDERSTAND HOW YALL MADE IT!?!?!",2026-06-19 07:52:20
cda5be24-23f3-4c6a-9a5a-1d91b694565c,Manirujjaman Mondal,Google Play,5.0,0.0,Listening to music on Spotify is much better than listening to music on YouTube.,2026-06-19 07:41:33
6c78f11c-a763-4b92-b303-fe1f1f01aeaa,Toni Phillips,Google Play,5.0,0.0,10/10 do recommend. it has every song that I like,2026-06-19 07:24:26
c774b9ce-b1f7-4760-b6ca-c04e518a23b0,Austin Underwood,Google Play,1.0,0.0,Use to be the best but now with the dj and enhanced shuffle and other annoying things i cant trun off adds more lag as well as an increase in issues and problems with the app. So much irrelevant stuff now on the main page and I can't even find new music from artists that I follow anymore seems like a basic thing that should have stayed in the app No clue why they got rid of it but the moves that they're making make me want to move to a completely different music app rather than paying for this.,2026-06-19 07:09:56
2c15ec18-fef1-4c48-a018-f0f964df0321,Wisdom Sampson,Google Play,1.0,0.0,I'm a premium user Spotify deleting my downloaded song and I'll download again thru the still do same thing,2026-06-19 07:04:36
36a71672-a16c-402e-aeb6-9cabcc1cf7c5,Jates,Google Play,2.0,1.0,Ive used the old widget 4 years n had no issue with it I used the widget more then the app shortcut when even i would just open the app when they came out with the new widget I had no interest in switching over cause I liked how the old one 1x4 worked n the new one was a 2x4 widget cause it gave you the option to open a Playlist I had no interest in the so I didnt switch now they forced me to switch now when I use the widget to open it im brought to a Playlist not the home screen i cant stand it,2026-06-19 06:23:59
bb0667b8-a4bf-4984-bdfe-65c2bccbaa78,Wyatt MacDonald,Google Play,5.0,0.0,I love to listen to music almost every day,2026-06-19 06:20:02
e83ec5c5-f901-4d9b-a64b-c501011abac5,Adnan Muse,Google Play,2.0,0.0,these adds are so out of hand every 3 listens they give u 2 adds its annoying.,2026-06-19 05:41:39
85308a4e-b4b5-4ba7-8e5c-c2ad84a75453,youcef bekhouche,Google Play,1.0,0.0,"i rather listen from youtube , too much spotify prremium ad",2026-06-19 05:36:58
772688a2-1f46-4ab8-801d-caffab78ee74,lloyd Bannister,Google Play,2.0,0.0,"I love Spotify, but since this new update it has been so buggy that I can't even listen to 10 seconds of a song before it's kicking me off explaining that there is bugs detected in Spotify so for this reason only I will give 2 stars please fix the problem and I will amend this to 5 stars thank you",2026-06-19 05:34:26
f69ab558-f5c8-4267-afa8-e743bf903a94,Juan S,Google Play,1.0,0.0,everything is behind a pay wall yes theirs some features but you have to pay for everything especially if you want to shuffle songs 🤦🏻‍♂️,2026-06-19 05:30:29
d1aa0f41-bcf1-4ccb-8a80-2f7b63f895e0,Anna Maria Varghese,Google Play,1.0,1.0,"i cant play the SONGS IN ORDER. when i click on to playlists, the only thing i can choose is a short clip of the song like come on man, choosing should be a basic feature. but the thing is that this is not a prob in phones ig. This problem is in my tab I aint gonna hear any music from this app anymore. Youtube music is much better than this",2026-06-19 05:08:50
5200dc71-90ba-4348-813e-658e04cbefd3,CJS,Google Play,1.0,0.0,Video playback is broken for podcasts,2026-06-19 05:03:32
d144bf3b-9444-4dd8-85fe-9d12da17fdac,Yeori,Google Play,2.0,0.0,"Used to be my favorite app for listening to music, but not anymore. There are ads more than before, and the amount of features they've locked behind premium is absurd. Can't even listen to the same song twice consecutively without premium. Spotify is becoming a cash grab.",2026-06-19 04:58:33
992f88da-71e1-47de-aaaa-79937fcb3b05,Nethmi Welladage don,Google Play,1.0,0.0,"This app is genuinely one of the bests for music, so why ruin it? why make it almost impossible to use? how come , that I have ads every 4 songs? and the ads? 12 seconds each and 4 or even more; in the end I'm just listening to the ads than the songs I want to hear. Just make people pay for the app already, since that's what is really going to happen if everything is really slowly becoming a premium feature.",2026-06-19 04:48:27
381de611-43a9-4d63-862d-970610b265de,REDACTED,Google Play,2.0,1.0,"Extremely disappointed, extremely money hungry. Cannot even move the music time bar and cannot even play the playlist down without having to pay for premium, YES they require premium to even disable shuffling.",2026-06-19 04:01:17
25b52c71-0868-4322-ab68-8cb6c4da6440,Jinny Seals,Google Play,1.0,0.0,"Don't use the ""lossless"" feature if you don't have unlimited data! Completely wiped out my total data of 25GB....my average monthly usage was 3-5GB before I tried ""lossless"". I usually listen OFFLINE and have been doing so as normal, but I hadn't realised that due to the nature of ""lossless"" it's constantly using data in the background to find the best version of the song you want to listen to. Probably a great feature if you are fully aware of the data implications. it's really rubbish if not.",2026-06-19 03:31:34
5818d94c-ccea-4cca-93d7-9f8a9b59b462,reiko.,Google Play,3.0,2.0,I like this app but why did you removed the loop option on,2026-06-19 03:30:30
6e2ac7c1-b63f-43d3-afce-632718728932,Jeff R,Google Play,3.0,0.0,The DJ keeps playing Latin music despite me never listening to it and skipping it when it puts it on. This has been a problem for months now. I have been paying for premium for years now but still have to deal with this issue which is really frustrating.,2026-06-19 03:30:19
f67debd1-9c6b-4534-9213-011505d1ecfe,Keneth Garcia,Google Play,5.0,0.0,I love Spotify even listend while in Mexico,2026-06-19 03:29:53
4b29d2ef-1065-470b-8430-34ea9affdaf7,Paulo,Google Play,2.0,6.0,"Radio option has become so unusable because of ""promotional tool for artists"" which increases likelihood of trash songs bring recommended.",2026-06-19 02:57:39
53c3d18a-c383-4268-abb1-76b95874ba19,Ben Hudson,Google Play,1.0,1.0,"The new widget is horrible. it has less useful functions in the same amount of space at the expense of bigger album art, bigger logo, and spacing on the top and bottom. The skip buttons no longer appear on the smaller 1x5 widget. Very disappointing",2026-06-19 02:46:57
b2ff396d-24ad-425b-b4dc-0768eebb9746,William Garcia,Google Play,1.0,0.0,Ever since they stopped giving the 30 minutes of music time without ads the free version is unbearable and unusable and it's because they want you to by the premium. i got through 2 2-3 minutes songs before I got 4 ads in a row and it's genuinely working because I can't listen to music when there is only 6-12 minutes of listening time then almost 3 minutes of ads,2026-06-19 02:44:50
bbda0811-df06-4a94-9133-ecfe8b884389,Ngozi Amadi,Google Play,4.0,0.0,Great music and sound... This would be my all time favorite music app They have albums ready for any mood you want Update artist albums with all there music together in one place🙏,2026-06-19 02:44:39
6e9c90c3-917e-40a9-b2f5-57c158298718,Sky,Google Play,4.0,0.0,I love it but it has too many ads and when I'm listening to podcasts I usually forget what the topic of what their talking about and it makes me lost and confused,2026-06-19 02:36:52
c2b98d77-6ed2-4c17-bdde-fda0577844a1,George,Google Play,1.0,0.0,Need a Spotify that only plays music no audiobooks no video just music.. It's great you entered the lossness age finally but you could do far better,2026-06-19 02:19:16
f8eb8c1f-a8d6-4ebc-aa34-7c2a54976839,Stephen Kazy,Google Play,3.0,0.0,"It's been a good app, but I feel like ""smart shuffle"" shouldn't be playing the same songs. It's starting to become like Pandora.",2026-06-19 02:13:38
47ad9199-6f52-450f-9205-f2f9628866a0,Siya 611,Google Play,1.0,0.0,"Title: This app has become terrible! Review: Spotify used to be great, but now it is completely ruined. There are way too many annoying ads. Whenever I search for a specific song, it forces me to listen to a whole playlist instead of that song. On top of that, you can only skip 6 songs in 2 hours! It is incredibly frustrating just trying to listen to one single song. This app seriously needs an urgent update and major improvements, otherwise, it is completely useless. Fix this or close it down!",2026-06-19 01:43:19
be984a1d-94c2-442e-b73a-10ba43e7ba02,Simphiwe Mlaba,Google Play,5.0,0.0,good vibes,2026-06-19 01:41:04
f8d2217d-4b36-4889-a087-7eee07779b50,Kristo Vaher,Google Play,1.0,0.0,Why can't they fix the bug that keeps pausing playlist plays randomly? For months. Despite updates.,2026-06-19 01:25:21
b6e10639-3740-4d7d-9c43-422aff7de452,Vicente De Leon,Google Play,5.0,0.0,This is an amazing experience that I am in love with because of good music and recommendations!!,2026-06-19 01:11:39
9ff69445-f27c-49aa-8347-7bb2944f9eb2,Shawna Cantrell,Google Play,5.0,0.0,Great app for music and audiobooks,2026-06-19 00:47:30
af78488f-ba72-409a-b44f-e35e8e219b90,Hayden mackay,Google Play,1.0,1.0,the old widget worked just fine. the new one is broken. keeps saying offline tap to refresh but does nothing. i can see the new widget fine. it doesn't work. let me have the old 4x1 back. after chatting to Eric on chat. we managed to fix the problem. and a couple days later it's broken again. just give me the old widget back. it worked. I'm not reinstalling an app weekly because your stupid decisions broke it.,2026-06-19 00:31:52
00bae1b6-90ce-4561-a6da-5df8f9775691,Aspen Clark,Google Play,4.0,1.0,besides all the ads this is the best music app ever I love it so much I can listen to all of my favorite artist,2026-06-19 00:19:13
0a423a99-8910-4ddb-9432-997c370424ec,Emma Wiens,Google Play,3.0,0.0,"at this point, I might as well use yt music because a lot of the stuff that I feel like should be part of the free version isn't like, we only get six skips per hour.And I agree, we hardly even get like any options of our own playlist, like we make the playlist.We don't want other people barging in on our own playlist. i really hope that eventually it gets better.Because it's really frustrating right now sometimes.",2026-06-19 00:04:17
05cf46e7-bce1-41f8-b541-a1e8920d957f,First name Surname,Google Play,1.0,1.0,"Horrible app. Very buggy, both mobile and desktop. It is laughably badly developed, even though spotify's only product is the software... It is almost insulting. I've used it on powerful PCs and had same issues. There are too many issues to name; the most prelevant ones are: extremely slow and buggy UI, horrible cache management (went to 50gb+ very quick), randomly switching to other device, etc etc. Even the shuffle was broken for many years... A 13 year old could code a better app...",2026-06-19 00:03:38
1084de6c-89af-4098-9a0d-8df235c604b7,mani kumar mani,Google Play,1.0,0.0,Full ads after 1 song... highly not recommended,2026-06-18 23:58:11
58c4e063-38dd-437f-8770-fdbe75c0e83e,Precious Okonkwo,Google Play,4.0,0.0,I love the vibe I am getting from the help,2026-06-18 23:53:51
6983372a-df90-4517-85fa-6f4103048b0b,Qais Salloum,Google Play,2.0,0.0,"Spotify needs to really calm down a notch, 3 ads then i could listen to one song, i skip the song but i have to listen to 4 ads now, believe me every time this happens I'm closing the app and switching to SoundCloud, this is a joke",2026-06-18 23:50:17
64b59ded-0d95-4a60-b04d-e67b12a243be,Vikkas Gupta,Google Play,4.0,0.0,should try if you like listening to songs but ads are irritating,2026-06-18 23:41:49
37fdd136-a37d-4447-81a9-6df6c8b0b79c,Elvis M Makudo,Google Play,5.0,0.0,it's a good site for listening to music and it's really fast,2026-06-18 23:41:06
e5fb7288-ae67-4b87-b5e3-ac74d1ad59e9,Nisarg Patel,Google Play,1.0,1.0,I hate to give this app even a single star rating... It just spoils the rhythm and music by its ads and restrict to even play the musics of our own choice after some clicks... too much restrictions for me towards an audio listening app... truly disaapointed 😞😞😮‍💨,2026-06-18 23:26:41
9ac5da5b-adb8-4eef-976b-f3797cb8b424,Kenzi Swanson,Google Play,5.0,0.0,"Spotify is literally my favorite thing in existence. Their recommendations are perfection, daily mixes are to die for, and I look forward to getting my top songs list every year. Couldn't live without it",2026-06-18 22:59:04
e8723dee-58a0-4c83-ae36-5cae36d47b7e,Hi Technique,Google Play,4.0,7.0,"most music is available, though music will sometimes be removed by artist for whatever reason. If music collection gets too large, Spotify can't handle it and will get VERY SLOW, to the point it can take entire minutes to boot up, and refuse to perform certain actions due to time-outs. but for most people it should be fine. I just have to many playlists.",2026-06-18 22:51:14
a89ddcaa-2251-4129-a822-7cc8d2f99efe,The exploded Airstrike,Google Play,1.0,0.0,"this app sucks, like aa lot. it does NOT even put the songs YOU PUT ON, on. it gives the recommended. AND you cant even play music while on another app, I recommend Youtube Music instead, it ACTUALLY puts songs on that you want and you can listen to music while playing a game or whatever without having an ad every 5 minutes...",2026-06-18 22:39:17
